-- phpMyAdmin SQL Dump
-- version 4.9.11
-- https://www.phpmyadmin.net/
--
-- Host: localhost:3306
-- Generation Time: Feb 26, 2023 at 12:44 PM
-- Server version: 10.3.38-MariaDB-log-cll-lve
-- PHP Version: 7.4.33

SET SQL_MODE = "NO_AUTO_VALUE_ON_ZERO";
SET AUTOCOMMIT = 0;
START TRANSACTION;
SET time_zone = "+00:00";


/*!40101 SET @OLD_CHARACTER_SET_CLIENT=@@CHARACTER_SET_CLIENT */;
/*!40101 SET @OLD_CHARACTER_SET_RESULTS=@@CHARACTER_SET_RESULTS */;
/*!40101 SET @OLD_COLLATION_CONNECTION=@@COLLATION_CONNECTION */;
/*!40101 SET NAMES utf8mb4 */;

--
-- Database: `apppdpmp_appasti`
--

-- --------------------------------------------------------

--
-- Table structure for table `admins`
--

CREATE TABLE `admins` (
  `id` bigint(20) UNSIGNED NOT NULL,
  `name` varchar(255) DEFAULT NULL,
  `email` varchar(255) DEFAULT NULL,
  `image` text DEFAULT NULL,
  `phone` varchar(100) DEFAULT NULL,
  `email_verified_at` timestamp NULL DEFAULT NULL,
  `password_reset` timestamp NULL DEFAULT NULL,
  `password` varchar(255) DEFAULT NULL,
  `remember_token` varchar(100) DEFAULT NULL,
  `created_at` timestamp NULL DEFAULT NULL,
  `updated_at` timestamp NULL DEFAULT NULL
) ENGINE=InnoDB DEFAULT CHARSET=utf8mb4 COLLATE=utf8mb4_unicode_ci;

--
-- Dumping data for table `admins`
--

INSERT INTO `admins` (`id`, `name`, `email`, `image`, `phone`, `email_verified_at`, `password_reset`, `password`, `remember_token`, `created_at`, `updated_at`) VALUES
(1, 'admin', 'alifadi91@hotmail.com', 'storage/admin/WUFpF8IHpZgjUSvnAIOQK2s8eRcLum8e6l9eGSJO.png', '01026638997', NULL, NULL, '$2y$10$Wyw1cyvwXa16AshqmJTbVep503qgjxx7qZjCgq8lmL67pz/UfBLGS', NULL, NULL, '2022-12-16 00:03:35'),
(20, 'walter', 'walter.gep@gmail.com', NULL, NULL, NULL, NULL, '$2y$10$6WJ8wLFrceozrtiz19ybyucpIU91pxgGWtDhTsuVmEGn8X.DlH91.', NULL, '2022-11-04 23:31:45', '2022-12-15 21:32:59'),
(22, 'Barbara', 'b.porta@multitime.ch', NULL, NULL, NULL, NULL, NULL, NULL, '2022-11-24 13:39:44', '2022-11-25 13:48:26'),
(23, 'Rachele', 'r.pretolani@multitime.ch', NULL, NULL, NULL, NULL, '$2y$10$ZdMCB40sMVtp0BhYdjBMwuPDkdeibJEQCxj9NdBgBl7hEe1y8BztW', NULL, '2022-11-25 13:48:14', '2022-12-20 13:32:14');

-- --------------------------------------------------------

--
-- Table structure for table `admin_notifications`
--

CREATE TABLE `admin_notifications` (
  `id` bigint(20) UNSIGNED NOT NULL,
  `message` text DEFAULT NULL,
  `is_read` tinyint(1) NOT NULL DEFAULT 0,
  `created_at` timestamp NULL DEFAULT NULL,
  `updated_at` timestamp NULL DEFAULT NULL
) ENGINE=MyISAM DEFAULT CHARSET=latin1 COLLATE=latin1_swedish_ci;

--
-- Dumping data for table `admin_notifications`
--

INSERT INTO `admin_notifications` (`id`, `message`, `is_read`, `created_at`, `updated_at`) VALUES
(1, 'Il menu è stato rifiutato Kebab con patatine 01.03.2023', 1, '2023-02-25 15:38:52', '2023-02-25 17:30:05'),
(2, 'Il menu è stato rifiutato Kebab con patatine 01.03.2023 della Multitime Quartz SA School', 1, '2023-02-25 19:16:08', '2023-02-25 19:16:23');

-- --------------------------------------------------------

--
-- Table structure for table `admin_permissions`
--

CREATE TABLE `admin_permissions` (
  `id` bigint(20) UNSIGNED NOT NULL,
  `permission_id` bigint(20) UNSIGNED DEFAULT NULL,
  `admin_id` bigint(20) UNSIGNED DEFAULT NULL,
  `created_at` timestamp NULL DEFAULT NULL,
  `updated_at` timestamp NULL DEFAULT NULL
) ENGINE=InnoDB DEFAULT CHARSET=utf8mb4 COLLATE=utf8mb4_general_ci;

--
-- Dumping data for table `admin_permissions`
--

INSERT INTO `admin_permissions` (`id`, `permission_id`, `admin_id`, `created_at`, `updated_at`) VALUES
(224, 1, 1, '2022-11-07 19:50:30', '2022-11-07 19:50:30'),
(225, 2, 1, '2022-11-07 19:50:30', '2022-11-07 19:50:30'),
(226, 3, 1, '2022-11-07 19:50:30', '2022-11-07 19:50:30'),
(227, 4, 1, '2022-11-07 19:50:30', '2022-11-07 19:50:30'),
(228, 5, 1, '2022-11-07 19:50:30', '2022-11-07 19:50:30'),
(229, 7, 1, '2022-11-07 19:50:30', '2022-11-07 19:50:30'),
(230, 9, 1, '2022-11-07 19:50:30', '2022-11-07 19:50:30'),
(231, 10, 1, '2022-11-07 19:50:30', '2022-11-07 19:50:30'),
(232, 11, 1, '2022-11-07 19:50:30', '2022-11-07 19:50:30'),
(233, 12, 1, '2022-11-07 19:50:30', '2022-11-07 19:50:30'),
(234, 13, 1, '2022-11-07 19:50:30', '2022-11-07 19:50:30'),
(235, 14, 1, '2022-11-07 19:50:30', '2022-11-07 19:50:30'),
(236, 15, 1, '2022-11-07 19:50:30', '2022-11-07 19:50:30'),
(237, 16, 1, '2022-11-07 19:50:30', '2022-11-07 19:50:30'),
(238, 19, 1, '2022-11-07 19:50:30', '2022-11-07 19:50:30'),
(239, 20, 1, '2022-11-07 19:50:30', '2022-11-07 19:50:30'),
(240, 21, 1, '2022-11-07 19:50:30', '2022-11-07 19:50:30'),
(241, 22, 1, '2022-11-07 19:50:30', '2022-11-07 19:50:30'),
(242, 39, 1, '2022-11-07 19:50:30', '2022-11-07 19:50:30'),
(243, 40, 1, '2022-11-07 19:50:30', '2022-11-07 19:50:30'),
(244, 41, 1, '2022-11-07 19:50:30', '2022-11-07 19:50:30'),
(245, 42, 1, '2022-11-07 19:50:30', '2022-11-07 19:50:30'),
(246, 52, 1, '2022-11-07 19:50:30', '2022-11-07 19:50:30'),
(247, 53, 1, '2022-11-07 19:50:30', '2022-11-07 19:50:30'),
(248, 23, 1, '2022-11-07 19:50:30', '2022-11-07 19:50:30'),
(249, 24, 1, '2022-11-07 19:50:30', '2022-11-07 19:50:30'),
(250, 25, 1, '2022-11-07 19:50:30', '2022-11-07 19:50:30'),
(251, 26, 1, '2022-11-07 19:50:30', '2022-11-07 19:50:30'),
(252, 51, 1, '2022-11-07 19:50:30', '2022-11-07 19:50:30'),
(631, 54, 1, NULL, NULL),
(632, 55, 1, NULL, NULL),
(633, 56, 1, NULL, NULL),
(634, 57, 1, NULL, NULL),
(701, 1, 22, '2022-12-15 19:30:48', '2022-12-15 19:30:48'),
(702, 2, 22, '2022-12-15 19:30:48', '2022-12-15 19:30:48'),
(703, 3, 22, '2022-12-15 19:30:48', '2022-12-15 19:30:48'),
(704, 4, 22, '2022-12-15 19:30:48', '2022-12-15 19:30:48'),
(705, 5, 22, '2022-12-15 19:30:48', '2022-12-15 19:30:48'),
(706, 7, 22, '2022-12-15 19:30:48', '2022-12-15 19:30:48'),
(707, 9, 22, '2022-12-15 19:30:48', '2022-12-15 19:30:48'),
(708, 10, 22, '2022-12-15 19:30:48', '2022-12-15 19:30:48'),
(709, 11, 22, '2022-12-15 19:30:48', '2022-12-15 19:30:48'),
(710, 12, 22, '2022-12-15 19:30:48', '2022-12-15 19:30:48'),
(711, 13, 22, '2022-12-15 19:30:48', '2022-12-15 19:30:48'),
(712, 14, 22, '2022-12-15 19:30:48', '2022-12-15 19:30:48'),
(713, 15, 22, '2022-12-15 19:30:48', '2022-12-15 19:30:48'),
(714, 16, 22, '2022-12-15 19:30:48', '2022-12-15 19:30:48'),
(715, 19, 22, '2022-12-15 19:30:48', '2022-12-15 19:30:48'),
(716, 20, 22, '2022-12-15 19:30:48', '2022-12-15 19:30:48'),
(717, 21, 22, '2022-12-15 19:30:48', '2022-12-15 19:30:48'),
(718, 22, 22, '2022-12-15 19:30:48', '2022-12-15 19:30:48'),
(719, 39, 22, '2022-12-15 19:30:48', '2022-12-15 19:30:48'),
(720, 40, 22, '2022-12-15 19:30:48', '2022-12-15 19:30:48'),
(721, 41, 22, '2022-12-15 19:30:48', '2022-12-15 19:30:48'),
(722, 42, 22, '2022-12-15 19:30:48', '2022-12-15 19:30:48'),
(723, 52, 22, '2022-12-15 19:30:48', '2022-12-15 19:30:48'),
(724, 53, 22, '2022-12-15 19:30:48', '2022-12-15 19:30:48'),
(725, 23, 22, '2022-12-15 19:30:48', '2022-12-15 19:30:48'),
(726, 24, 22, '2022-12-15 19:30:48', '2022-12-15 19:30:48'),
(727, 25, 22, '2022-12-15 19:30:48', '2022-12-15 19:30:48'),
(728, 26, 22, '2022-12-15 19:30:48', '2022-12-15 19:30:48'),
(729, 51, 22, '2022-12-15 19:30:48', '2022-12-15 19:30:48'),
(730, 54, 22, '2022-12-15 19:30:48', '2022-12-15 19:30:48'),
(731, 55, 22, '2022-12-15 19:30:48', '2022-12-15 19:30:48'),
(732, 56, 22, '2022-12-15 19:30:48', '2022-12-15 19:30:48'),
(733, 57, 22, '2022-12-15 19:30:48', '2022-12-15 19:30:48'),
(833, 1, 20, '2022-12-15 21:32:59', '2022-12-15 21:32:59'),
(834, 2, 20, '2022-12-15 21:32:59', '2022-12-15 21:32:59'),
(835, 3, 20, '2022-12-15 21:32:59', '2022-12-15 21:32:59'),
(836, 4, 20, '2022-12-15 21:32:59', '2022-12-15 21:32:59'),
(837, 5, 20, '2022-12-15 21:32:59', '2022-12-15 21:32:59'),
(838, 7, 20, '2022-12-15 21:32:59', '2022-12-15 21:32:59'),
(839, 9, 20, '2022-12-15 21:32:59', '2022-12-15 21:32:59'),
(840, 10, 20, '2022-12-15 21:32:59', '2022-12-15 21:32:59'),
(841, 11, 20, '2022-12-15 21:32:59', '2022-12-15 21:32:59'),
(842, 12, 20, '2022-12-15 21:32:59', '2022-12-15 21:32:59'),
(843, 13, 20, '2022-12-15 21:32:59', '2022-12-15 21:32:59'),
(844, 14, 20, '2022-12-15 21:32:59', '2022-12-15 21:32:59'),
(845, 15, 20, '2022-12-15 21:32:59', '2022-12-15 21:32:59'),
(846, 16, 20, '2022-12-15 21:32:59', '2022-12-15 21:32:59'),
(847, 19, 20, '2022-12-15 21:32:59', '2022-12-15 21:32:59'),
(848, 20, 20, '2022-12-15 21:32:59', '2022-12-15 21:32:59'),
(849, 21, 20, '2022-12-15 21:32:59', '2022-12-15 21:32:59'),
(850, 22, 20, '2022-12-15 21:32:59', '2022-12-15 21:32:59'),
(851, 39, 20, '2022-12-15 21:32:59', '2022-12-15 21:32:59'),
(852, 40, 20, '2022-12-15 21:32:59', '2022-12-15 21:32:59'),
(853, 41, 20, '2022-12-15 21:32:59', '2022-12-15 21:32:59'),
(854, 42, 20, '2022-12-15 21:32:59', '2022-12-15 21:32:59'),
(855, 52, 20, '2022-12-15 21:32:59', '2022-12-15 21:32:59'),
(856, 53, 20, '2022-12-15 21:32:59', '2022-12-15 21:32:59'),
(857, 23, 20, '2022-12-15 21:32:59', '2022-12-15 21:32:59'),
(858, 24, 20, '2022-12-15 21:32:59', '2022-12-15 21:32:59'),
(859, 25, 20, '2022-12-15 21:32:59', '2022-12-15 21:32:59'),
(860, 26, 20, '2022-12-15 21:32:59', '2022-12-15 21:32:59'),
(861, 51, 20, '2022-12-15 21:32:59', '2022-12-15 21:32:59'),
(862, 54, 20, '2022-12-15 21:32:59', '2022-12-15 21:32:59'),
(863, 55, 20, '2022-12-15 21:32:59', '2022-12-15 21:32:59'),
(864, 56, 20, '2022-12-15 21:32:59', '2022-12-15 21:32:59'),
(865, 57, 20, '2022-12-15 21:32:59', '2022-12-15 21:32:59'),
(866, 1, 23, '2022-12-20 13:32:14', '2022-12-20 13:32:14'),
(867, 2, 23, '2022-12-20 13:32:14', '2022-12-20 13:32:14'),
(868, 3, 23, '2022-12-20 13:32:14', '2022-12-20 13:32:14'),
(869, 4, 23, '2022-12-20 13:32:14', '2022-12-20 13:32:14'),
(870, 5, 23, '2022-12-20 13:32:14', '2022-12-20 13:32:14'),
(871, 7, 23, '2022-12-20 13:32:14', '2022-12-20 13:32:14'),
(872, 9, 23, '2022-12-20 13:32:14', '2022-12-20 13:32:14'),
(873, 10, 23, '2022-12-20 13:32:14', '2022-12-20 13:32:14'),
(874, 11, 23, '2022-12-20 13:32:14', '2022-12-20 13:32:14'),
(875, 12, 23, '2022-12-20 13:32:14', '2022-12-20 13:32:14'),
(876, 13, 23, '2022-12-20 13:32:14', '2022-12-20 13:32:14'),
(877, 14, 23, '2022-12-20 13:32:14', '2022-12-20 13:32:14'),
(878, 15, 23, '2022-12-20 13:32:14', '2022-12-20 13:32:14'),
(879, 16, 23, '2022-12-20 13:32:14', '2022-12-20 13:32:14'),
(880, 19, 23, '2022-12-20 13:32:14', '2022-12-20 13:32:14'),
(881, 20, 23, '2022-12-20 13:32:14', '2022-12-20 13:32:14'),
(882, 21, 23, '2022-12-20 13:32:14', '2022-12-20 13:32:14'),
(883, 22, 23, '2022-12-20 13:32:14', '2022-12-20 13:32:14'),
(884, 39, 23, '2022-12-20 13:32:14', '2022-12-20 13:32:14'),
(885, 40, 23, '2022-12-20 13:32:14', '2022-12-20 13:32:14'),
(886, 41, 23, '2022-12-20 13:32:14', '2022-12-20 13:32:14'),
(887, 42, 23, '2022-12-20 13:32:14', '2022-12-20 13:32:14'),
(888, 52, 23, '2022-12-20 13:32:14', '2022-12-20 13:32:14'),
(889, 53, 23, '2022-12-20 13:32:14', '2022-12-20 13:32:14'),
(890, 23, 23, '2022-12-20 13:32:14', '2022-12-20 13:32:14'),
(891, 24, 23, '2022-12-20 13:32:14', '2022-12-20 13:32:14'),
(892, 25, 23, '2022-12-20 13:32:14', '2022-12-20 13:32:14'),
(893, 26, 23, '2022-12-20 13:32:14', '2022-12-20 13:32:14'),
(894, 51, 23, '2022-12-20 13:32:14', '2022-12-20 13:32:14'),
(895, 54, 23, '2022-12-20 13:32:14', '2022-12-20 13:32:14'),
(896, 55, 23, '2022-12-20 13:32:14', '2022-12-20 13:32:14'),
(897, 56, 23, '2022-12-20 13:32:14', '2022-12-20 13:32:14'),
(898, 57, 23, '2022-12-20 13:32:14', '2022-12-20 13:32:14');

-- --------------------------------------------------------

--
-- Table structure for table `classes`
--

CREATE TABLE `classes` (
  `id` bigint(20) UNSIGNED NOT NULL,
  `school_id` bigint(20) UNSIGNED DEFAULT NULL,
  `name` varchar(191) DEFAULT NULL,
  `created_at` timestamp NULL DEFAULT NULL,
  `updated_at` timestamp NULL DEFAULT NULL
) ENGINE=InnoDB DEFAULT CHARSET=utf8mb4 COLLATE=utf8mb4_general_ci;

--
-- Dumping data for table `classes`
--

INSERT INTO `classes` (`id`, `school_id`, `name`, `created_at`, `updated_at`) VALUES
(9, 16, 'Multitime Zandone', '2022-12-18 01:35:56', '2022-12-18 01:56:40'),
(10, 16, 'Multitime Montana', '2022-12-18 01:51:54', '2022-12-18 01:56:28');

-- --------------------------------------------------------

--
-- Table structure for table `contacts`
--

CREATE TABLE `contacts` (
  `id` bigint(20) UNSIGNED NOT NULL,
  `user_id` bigint(20) UNSIGNED DEFAULT NULL,
  `school_id` bigint(20) UNSIGNED DEFAULT NULL,
  `name` varchar(191) DEFAULT NULL,
  `mail` varchar(191) DEFAULT NULL,
  `subject` varchar(191) DEFAULT NULL,
  `message` text DEFAULT NULL,
  `created_at` timestamp NULL DEFAULT NULL,
  `updated_at` timestamp NULL DEFAULT NULL
) ENGINE=InnoDB DEFAULT CHARSET=utf8mb4 COLLATE=utf8mb4_unicode_ci;

--
-- Dumping data for table `contacts`
--

INSERT INTO `contacts` (`id`, `user_id`, `school_id`, `name`, `mail`, `subject`, `message`, `created_at`, `updated_at`) VALUES
(29, 39, NULL, NULL, 'Rachele.pretolani@hotmail.it', 'ciao', 'ciao', '2023-02-11 13:08:55', '2023-02-11 13:08:55');

-- --------------------------------------------------------

--
-- Table structure for table `menus`
--

CREATE TABLE `menus` (
  `id` bigint(20) UNSIGNED NOT NULL,
  `name` varchar(191) DEFAULT NULL,
  `image` varchar(191) DEFAULT NULL,
  `type` enum('menu','addition') NOT NULL DEFAULT 'menu',
  `date` date DEFAULT NULL,
  `price` varchar(191) NOT NULL DEFAULT '0',
  `description` text DEFAULT NULL,
  `created_at` timestamp NULL DEFAULT NULL,
  `updated_at` timestamp NULL DEFAULT NULL
) ENGINE=InnoDB DEFAULT CHARSET=utf8mb4 COLLATE=utf8mb4_unicode_ci;

--
-- Dumping data for table `menus`
--

INSERT INTO `menus` (`id`, `name`, `image`, `type`, `date`, `price`, `description`, `created_at`, `updated_at`) VALUES
(29, 'Kebab con patatine 01.03.2023', NULL, 'menu', '2023-03-01', '8.50', 'Il primo menù di oggi è composto di\r\nkebab e patatine fritte e un gelato alla vanilla', '2022-12-06 23:45:39', '2023-02-20 05:12:26'),
(30, 'Polenta con manzo 01.03.2023', NULL, 'menu', '2023-03-01', '9.00', 'il nostro secondo menù è plenta \r\ncon carne di manzo e un ghiacciolio limone', '2022-12-06 23:52:03', '2023-02-20 05:12:14'),
(31, 'Menù vegeteriano 01.03.2023', NULL, 'menu', '2023-03-01', '8.50', 'il nostro menù vegeteriano compsto di \r\npolpette di ceci e una insalata mista con\r\n un gelato alla vanilla', '2022-12-06 23:54:40', '2023-02-20 05:12:05'),
(32, 'Menù 1 kebab 28.02.2023', NULL, 'menu', '2023-02-28', '9.50', 'kebab di pollo con patatine fritte e \r\nanelli di cipolla con un crema di vanillia', '2022-12-07 00:05:30', '2023-02-20 05:11:28'),
(33, 'Menù 1 Riso al Churry 28.02.2023', NULL, 'menu', '2023-02-28', '10', 'Riso al Churry con insalata mista e carne di pollo 🐔\r\ne un gelato alla vaniglia sia normale che lattosio', '2022-12-07 01:32:00', '2023-02-20 05:11:09'),
(34, 'Menù 2 Pasta al Ragù 28.02.2023', NULL, 'menu', '2023-02-28', '9.80', 'Pasta al Ragù 🍝\r\nInsalata mista 🥗\r\nGhiacciolo 🍦', '2022-12-07 01:37:58', '2023-02-20 05:10:54'),
(35, 'Menù 3 Lasagne al forno 27.02.2023', NULL, 'menu', '2023-02-27', '7.80', 'Lasagne al forno\r\nInsalata mista\r\nGelato alla vaniglia', '2022-12-07 01:39:07', '2023-02-20 05:10:35'),
(36, 'Menù del giorno 27.02.2023', NULL, 'menu', '2023-02-27', '10', 'Pizza 🍕\r\nInsalata\r\nCoca cola', '2022-12-07 01:42:08', '2023-02-20 05:10:23'),
(37, 'Menù Hamburger 27.02.2023', NULL, 'menu', '2023-02-27', '9.50', 'Hamburger 🍔\r\nPatatine fritte\r\nCoca cola', '2022-12-07 01:42:55', '2023-02-20 05:10:14'),
(38, 'Menù 1 24.02.2023', NULL, 'menu', '2023-02-24', '10', '1\r\n2\r\n3', '2022-12-15 13:03:28', '2023-02-20 05:09:42'),
(39, 'Menù 2 24.02.2023', NULL, 'menu', '2023-02-24', '10', '1\r\n2\r\n3', '2022-12-15 13:06:50', '2023-02-20 05:09:30'),
(40, 'Menù 3 24.02.2023', NULL, 'menu', '2023-02-24', '10', '1\r\n2\r\n3', '2022-12-15 13:07:16', '2023-02-20 05:09:20'),
(41, 'Menù 1 23.02.2023', NULL, 'menu', '2023-02-23', '10', '1\r\n2\r\n3', '2022-12-15 13:07:41', '2023-02-20 05:08:59'),
(42, 'Menù 2 23.02.2023', NULL, 'menu', '2023-02-23', '10', '1\r\n2\r\n3', '2022-12-15 13:08:03', '2023-02-20 05:08:49'),
(43, 'Menù 3 23.02.2023', NULL, 'menu', '2023-02-23', '10', '1-\r\n2-\r\n3-', '2022-12-15 13:17:14', '2023-02-20 05:08:21'),
(44, 'Menù 1 22.02.2023', NULL, 'menu', '2023-02-22', '10', '1-\r\n2-\r\n3-', '2022-12-15 13:17:48', '2023-02-20 05:07:58'),
(45, 'Menù 2 22.02.2023', NULL, 'menu', '2023-02-22', '10', '1-\r\n2-\r\n3-', '2022-12-15 13:18:31', '2023-02-20 05:07:40'),
(46, 'Menù 3 22.02.2023', NULL, 'menu', '2023-02-22', '10', '1-\r\n2-\r\n3-', '2022-12-15 13:19:18', '2023-02-20 05:07:24'),
(47, 'Menù 1 21.02.2023', NULL, 'menu', '2023-02-21', '10', '1-\r\n2-\r\n3-', '2022-12-15 13:20:00', '2023-02-20 05:07:05'),
(48, 'Menù 2 21.02.2023', NULL, 'menu', '2023-02-21', '19', '1-\r\n2-\r\n3-', '2022-12-15 13:20:24', '2023-02-20 05:06:51'),
(49, 'Menù 3 21.02.2023', NULL, 'menu', '2023-02-21', '10', '1-\r\n2-', '2022-12-15 13:20:54', '2023-02-20 05:06:41'),
(50, 'menu per prova 20.02.2023', NULL, 'menu', '2023-02-20', '10', '1\r\n2\r\n3', '2023-01-23 13:29:46', '2023-02-20 05:06:10'),
(53, 'Menu\' 1 20.02.2023', NULL, 'menu', '2023-02-20', '3.80', 'Pasta con ragù', '2023-02-11 13:13:21', '2023-02-20 05:05:58'),
(54, 'Menu\' 2 20.02.2023', NULL, 'menu', '2023-02-20', '4.50', 'Insalata con patate', '2023-02-11 13:18:17', '2023-02-20 05:05:41');

-- --------------------------------------------------------

--
-- Table structure for table `menu_details`
--

CREATE TABLE `menu_details` (
  `id` bigint(20) UNSIGNED NOT NULL,
  `menu_id` bigint(20) UNSIGNED DEFAULT NULL,
  `name` varchar(191) DEFAULT NULL,
  `created_at` timestamp NULL DEFAULT NULL,
  `updated_at` timestamp NULL DEFAULT NULL
) ENGINE=InnoDB DEFAULT CHARSET=utf8mb4 COLLATE=utf8mb4_unicode_ci;

-- --------------------------------------------------------

--
-- Table structure for table `migrations`
--

CREATE TABLE `migrations` (
  `id` int(10) UNSIGNED NOT NULL,
  `migration` varchar(191) NOT NULL,
  `batch` int(11) NOT NULL
) ENGINE=InnoDB DEFAULT CHARSET=utf8mb4 COLLATE=utf8mb4_unicode_ci;

--
-- Dumping data for table `migrations`
--

INSERT INTO `migrations` (`id`, `migration`, `batch`) VALUES
(1, '2022_07_22_035012_create_schools_table', 1),
(2, '2022_08_10_201958_create_users_table', 1),
(3, '2022_08_10_202104_create_notifications_table', 1),
(4, '2022_08_10_202218_create_orders_table', 1),
(5, '2022_08_10_202255_create_settings_table', 1),
(6, '2022_08_10_202310_create_contacts_table', 1),
(7, '2022_10_22_040516_create_menus_table', 1),
(8, '2022_10_22_040547_create_menu_details_table', 1),
(9, '2022_10_22_041200_create_school_menus_table', 1),
(10, '2022_10_22_202756_create_order_details_table', 1);

-- --------------------------------------------------------

--
-- Table structure for table `notifications`
--

CREATE TABLE `notifications` (
  `id` bigint(20) UNSIGNED NOT NULL,
  `user_id` bigint(20) UNSIGNED DEFAULT NULL,
  `school_id` bigint(20) UNSIGNED DEFAULT NULL,
  `title` varchar(191) DEFAULT NULL,
  `message` varchar(191) DEFAULT NULL,
  `is_read` int(11) NOT NULL DEFAULT 0,
  `created_at` timestamp NULL DEFAULT NULL,
  `updated_at` timestamp NULL DEFAULT NULL
) ENGINE=InnoDB DEFAULT CHARSET=utf8mb4 COLLATE=utf8mb4_unicode_ci;

--
-- Dumping data for table `notifications`
--

INSERT INTO `notifications` (`id`, `user_id`, `school_id`, `title`, `message`, `is_read`, `created_at`, `updated_at`) VALUES
(43, NULL, 16, 'messaggio di attivazione', 'Il tuo account è stato attivato con successo', 1, '2022-11-08 18:59:53', '2023-02-20 05:01:07'),
(44, NULL, 16, 'nota', 'prova per la notifica', 1, '2022-11-09 17:51:26', '2023-02-20 05:01:07'),
(48, NULL, 16, 'Lo stato del tuo ordine è cambiato', 'La tua richiesta è stata completata', 1, '2022-11-22 20:29:25', '2023-02-20 05:01:07'),
(50, NULL, 16, 'Lo stato del tuo ordine è cambiato', 'La tua richiesta è stata completata', 1, '2022-11-22 20:29:30', '2023-02-20 05:01:07'),
(52, NULL, 16, 'Lo stato del tuo ordine è cambiato', 'La tua richiesta è stata completata', 1, '2022-11-22 20:29:34', '2023-02-20 05:01:07'),
(54, NULL, 16, 'Lo stato del tuo ordine è cambiato', 'La tua richiesta è stata completata', 1, '2022-11-22 20:33:54', '2023-02-20 05:01:07'),
(56, NULL, 16, 'Lo stato del tuo ordine è cambiato', 'La tua richiesta è stata completata', 1, '2022-11-22 20:34:14', '2023-02-20 05:01:07'),
(58, NULL, 16, 'Lo stato del tuo ordine è cambiato', 'La tua richiesta è stata completata', 1, '2022-11-22 20:34:19', '2023-02-20 05:01:07'),
(60, NULL, 16, 'Lo stato del tuo ordine è cambiato', 'La tua richiesta è stata completata', 1, '2022-11-22 20:34:23', '2023-02-20 05:01:07'),
(62, NULL, 16, 'PRENOTAZIONE PASTO', 'ENTRO LE ORE 10:00 PER IL PRANZO SUCCESSIVO', 1, '2022-11-24 11:32:50', '2023-02-20 05:01:07'),
(69, NULL, 16, 'Lo stato del tuo ordine è cambiato', 'La tua richiesta è in preparazione', 1, '2022-12-01 17:01:13', '2023-02-20 05:01:07'),
(71, NULL, 16, 'Lo stato del tuo ordine è cambiato', 'La tua richiesta è stata completata', 1, '2022-12-01 17:01:39', '2023-02-20 05:01:07'),
(88, NULL, NULL, 'Lo stato del tuo ordine è cambiato', 'La tua richiesta è stata completata', 0, '2022-12-05 01:59:07', '2022-12-05 01:59:07'),
(90, NULL, 16, 'Lo stato del tuo ordine è cambiato', 'La tua richiesta è in preparazione', 1, '2022-12-05 01:59:45', '2023-02-20 05:01:07'),
(92, NULL, 16, 'Lo stato del tuo ordine è cambiato', 'La tua richiesta è stata completata', 1, '2022-12-05 01:59:56', '2023-02-20 05:01:07'),
(93, NULL, 16, 'Nuovo Menù dispiace ', 'Nuovo Menù dispiace per il Lunedì  05-12-2022', 1, '2022-12-05 05:27:49', '2023-02-20 05:01:07'),
(95, NULL, 16, 'Nuovo Menù dispiace ', 'Nuovo Menù dispiace per il Sabato  31-12-2022', 1, '2022-12-05 05:33:37', '2023-02-20 05:01:07'),
(100, NULL, 16, 'Nuovo Menù disponibile ', 'Nuovo Menù disponibile per il Mercoledì  07-12-2022', 1, '2022-12-05 15:19:08', '2023-02-20 05:01:07'),
(123, NULL, 16, 'Nuovo Menù disponibile ', 'Nuovo Menù disponibile per il Mercoledì  07-12-2022', 1, '2022-12-06 23:45:39', '2023-02-20 05:01:07'),
(126, NULL, 16, 'Nuovo Menù disponibile ', 'Nuovo Menù disponibile per il Mercoledì  07-12-2022', 1, '2022-12-06 23:52:03', '2023-02-20 05:01:07'),
(129, NULL, 16, 'Nuovo Menù disponibile ', 'Nuovo Menù disponibile per il Mercoledì  07-12-2022', 1, '2022-12-06 23:54:40', '2023-02-20 05:01:07'),
(142, NULL, 16, 'Nuovo Menù disponibile ', 'Nuovo Menù disponibile per il Mercoledì  07-12-2022', 1, '2022-12-07 00:05:30', '2023-02-20 05:01:07'),
(145, NULL, 16, 'Nuovo Menù disponibile ', 'Nuovo Menù disponibile per il Mercoledì  07-12-2022', 1, '2022-12-07 00:10:08', '2023-02-20 05:01:07'),
(148, NULL, 16, 'Nuovo Menù disponibile ', 'Nuovo Menù disponibile per il Sabato  10-12-2022', 1, '2022-12-07 01:32:00', '2023-02-20 05:01:07'),
(151, NULL, 16, 'Nuovo Menù disponibile ', 'Nuovo Menù disponibile per il Sabato  10-12-2022', 1, '2022-12-07 01:37:58', '2023-02-20 05:01:07'),
(154, NULL, 16, 'Nuovo Menù disponibile ', 'Nuovo Menù disponibile per il Sabato  10-12-2022', 1, '2022-12-07 01:39:07', '2023-02-20 05:01:07'),
(159, NULL, 16, 'Nuovo Menù disponibile ', 'Nuovo Menù disponibile per il Venerdì  09-12-2022', 1, '2022-12-07 01:42:08', '2023-02-20 05:01:07'),
(160, NULL, 16, 'Nuovo Menù disponibile ', 'Nuovo Menù disponibile per il Venerdì  09-12-2022', 1, '2022-12-07 01:42:55', '2023-02-20 05:01:07'),
(165, NULL, NULL, 'Lo stato del tuo ordine è cambiato', 'La tua richiesta è stata completata', 0, '2022-12-07 04:01:06', '2022-12-07 04:01:06'),
(174, NULL, 16, 'Lo stato del tuo ordine è cambiato', 'La tua richiesta è in preparazione', 1, '2022-12-07 14:18:56', '2023-02-20 05:01:07'),
(197, NULL, 16, 'Lo stato del tuo ordine è cambiato', 'La tua richiesta è stata completata', 1, '2022-12-09 15:45:08', '2023-02-20 05:01:07'),
(200, NULL, 16, 'Lo stato del tuo ordine è cambiato', 'La tua richiesta è stata completata', 1, '2022-12-09 15:45:17', '2023-02-20 05:01:07'),
(202, NULL, 16, 'Lo stato del tuo ordine è cambiato', 'La tua richiesta è stata completata', 1, '2022-12-09 15:45:24', '2023-02-20 05:01:07'),
(204, NULL, 16, 'Lo stato del tuo ordine è cambiato', 'La tua richiesta è stata completata', 1, '2022-12-09 15:45:32', '2023-02-20 05:01:07'),
(208, NULL, 16, 'Lo stato del tuo ordine è cambiato', 'La tua richiesta è stata completata', 1, '2022-12-09 15:45:38', '2023-02-20 05:01:07'),
(294, NULL, 16, 'ATTENZIONE', 'BACIONI', 1, '2022-12-14 19:10:49', '2023-02-20 05:01:07'),
(296, NULL, 16, 'CIAO', 'CIAO', 1, '2022-12-14 19:12:19', '2023-02-20 05:01:07'),
(330, NULL, 16, 'Nuovo Menù disponibile ', 'Nuovo Menù disponibile per il Mercoledì  21-12-2022', 1, '2022-12-15 13:03:28', '2023-02-20 05:01:07'),
(331, NULL, 16, 'Nuovo Menù disponibile ', 'Nuovo Menù disponibile per il Mercoledì  21-12-2022', 1, '2022-12-15 13:06:50', '2023-02-20 05:01:07'),
(332, NULL, 16, 'Nuovo Menù disponibile ', 'Nuovo Menù disponibile per il Mercoledì  21-12-2022', 1, '2022-12-15 13:07:16', '2023-02-20 05:01:07'),
(333, NULL, 16, 'Nuovo Menù disponibile ', 'Nuovo Menù disponibile per il Giovedì  22-12-2022', 1, '2022-12-15 13:07:41', '2023-02-20 05:01:07'),
(334, NULL, 16, 'Nuovo Menù disponibile ', 'Nuovo Menù disponibile per il Giovedì  22-12-2022', 1, '2022-12-15 13:08:03', '2023-02-20 05:01:07'),
(335, NULL, 16, 'Nuovo Menù disponibile ', 'Nuovo Menù disponibile per il Giovedì  22-12-2022', 1, '2022-12-15 13:17:14', '2023-02-20 05:01:07'),
(336, NULL, 16, 'Nuovo Menù disponibile ', 'Nuovo Menù disponibile per il Venerdì  23-12-2022', 1, '2022-12-15 13:17:48', '2023-02-20 05:01:07'),
(337, NULL, 16, 'Nuovo Menù disponibile ', 'Nuovo Menù disponibile per il Venerdì  23-12-2022', 1, '2022-12-15 13:18:31', '2023-02-20 05:01:07'),
(338, NULL, 16, 'Nuovo Menù disponibile ', 'Nuovo Menù disponibile per il Venerdì  23-12-2022', 1, '2022-12-15 13:19:18', '2023-02-20 05:01:07'),
(339, NULL, 16, 'Nuovo Menù disponibile ', 'Nuovo Menù disponibile per il Giovedì  15-12-2022', 1, '2022-12-15 13:20:00', '2023-02-20 05:01:07'),
(340, NULL, 16, 'Nuovo Menù disponibile ', 'Nuovo Menù disponibile per il Giovedì  15-12-2022', 1, '2022-12-15 13:20:24', '2023-02-20 05:01:07'),
(341, NULL, 16, 'Nuovo Menù disponibile ', 'Nuovo Menù disponibile per il Giovedì  15-12-2022', 1, '2022-12-15 13:20:54', '2023-02-20 05:01:07'),
(386, NULL, 16, 'prova messaggio dolce wa', 'prova messaggio dolce festa', 1, '2022-12-15 16:57:38', '2023-02-20 05:01:07'),
(387, NULL, 16, 'Nuovo Menù disponibile ', 'Nuovo Menù disponibile per il Giovedì  15-12-2022', 1, '2022-12-15 17:08:15', '2023-02-20 05:01:07'),
(391, NULL, 16, 'ciao', 'ciao', 1, '2022-12-15 19:12:09', '2023-02-20 05:01:07'),
(400, NULL, NULL, 'Lo stato del tuo ordine è cambiato', 'La tua richiesta è stata completata', 0, '2022-12-16 00:04:35', '2022-12-16 00:04:35'),
(401, NULL, NULL, 'Lo stato del tuo ordine è cambiato', 'La tua richiesta è stata completata', 0, '2022-12-16 00:18:53', '2022-12-16 00:18:53'),
(410, NULL, NULL, 'Lo stato del tuo ordine è cambiato', 'La tua richiesta è stata completata', 0, '2022-12-18 02:53:35', '2022-12-18 02:53:35'),
(411, NULL, NULL, 'Lo stato del tuo ordine è cambiato', 'La tua richiesta è stata completata', 0, '2022-12-18 02:56:14', '2022-12-18 02:56:14'),
(412, NULL, NULL, 'Lo stato del tuo ordine è cambiato', 'La tua richiesta è stata completata', 0, '2022-12-18 02:56:22', '2022-12-18 02:56:22'),
(414, NULL, NULL, 'Lo stato del tuo ordine è cambiato', 'La tua richiesta è stata completata', 0, '2022-12-18 04:15:58', '2022-12-18 04:15:58'),
(415, NULL, NULL, 'Lo stato del tuo ordine è cambiato', 'La tua richiesta è stata completata', 0, '2022-12-18 04:16:01', '2022-12-18 04:16:01'),
(416, NULL, NULL, 'Lo stato del tuo ordine è cambiato', 'La tua richiesta è stata completata', 0, '2022-12-18 04:16:04', '2022-12-18 04:16:04'),
(417, NULL, NULL, 'Lo stato del tuo ordine è cambiato', 'La tua richiesta è stata completata', 0, '2022-12-18 04:16:08', '2022-12-18 04:16:08'),
(418, NULL, NULL, 'Lo stato del tuo ordine è cambiato', 'La tua richiesta è stata completata', 0, '2022-12-18 04:16:12', '2022-12-18 04:16:12'),
(419, NULL, NULL, 'Lo stato del tuo ordine è cambiato', 'La tua richiesta è stata completata', 0, '2022-12-18 04:16:15', '2022-12-18 04:16:15'),
(439, NULL, 16, 'Nuovo Menù disponibile ', 'Nuovo Menù disponibile per il Venerdì  23-12-2022', 1, '2022-12-20 04:04:43', '2023-02-20 05:01:07'),
(498, 39, NULL, 'Notifica per ordinare pranzo', 'Ti ricordiamo di effettuare l’ordine del pranzo per domani entro le ore 10:00', 1, '2022-12-21 12:00:47', '2023-02-23 23:57:03'),
(499, 40, NULL, 'Notifica per ordinare pranzo', 'Ti ricordiamo di effettuare l’ordine del pranzo per domani entro le ore 10:00', 1, '2022-12-21 12:00:47', '2022-12-22 13:21:43'),
(500, 41, NULL, 'Notifica per ordinare pranzo', 'Ti ricordiamo di effettuare l’ordine del pranzo per domani entro le ore 10:00', 1, '2022-12-21 12:00:47', '2023-02-12 01:27:23'),
(501, 43, NULL, 'Notifica per ordinare pranzo', 'Ti ricordiamo di effettuare l’ordine del pranzo per domani entro le ore 10:00', 1, '2022-12-21 12:00:47', '2023-02-20 21:54:54'),
(503, 45, NULL, 'Notifica per ordinare pranzo', 'Ti ricordiamo di effettuare l’ordine del pranzo per domani entro le ore 10:00', 1, '2022-12-21 12:00:47', '2023-02-20 05:20:55'),
(504, 39, NULL, 'Notifica per l\'ordine', 'Non è più possibile modificare o annullare l\'ordine ora il tuo ordine in fase di preparazione.', 1, '2022-12-21 14:00:38', '2023-02-23 23:57:03'),
(505, 40, NULL, 'Notifica per l\'ordine', 'Non è più possibile modificare o annullare l\'ordine ora il tuo ordine in fase di preparazione.', 1, '2022-12-21 14:00:38', '2022-12-22 13:21:43'),
(506, 41, NULL, 'Notifica per l\'ordine', 'Non è più possibile modificare o annullare l\'ordine ora il tuo ordine in fase di preparazione.', 1, '2022-12-21 14:00:38', '2023-02-12 01:27:23'),
(507, 43, NULL, 'Notifica per l\'ordine', 'Non è più possibile modificare o annullare l\'ordine ora il tuo ordine in fase di preparazione.', 1, '2022-12-21 14:00:38', '2023-02-20 21:54:54'),
(509, 45, NULL, 'Notifica per l\'ordine', 'Non è più possibile modificare o annullare l\'ordine ora il tuo ordine in fase di preparazione.', 1, '2022-12-21 14:00:38', '2023-02-20 05:20:55'),
(510, 39, NULL, 'Hi Every One', 'Welcome In App Pasti', 1, '2022-12-21 16:05:14', '2023-02-23 23:57:03'),
(511, 40, NULL, 'Hi Every One', 'Welcome In App Pasti', 1, '2022-12-21 16:05:14', '2022-12-22 13:21:43'),
(512, 41, NULL, 'Hi Every One', 'Welcome In App Pasti', 1, '2022-12-21 16:05:14', '2023-02-12 01:27:23'),
(513, 43, NULL, 'Hi Every One', 'Welcome In App Pasti', 1, '2022-12-21 16:05:14', '2023-02-20 21:54:54'),
(515, 45, NULL, 'Hi Every One', 'Welcome In App Pasti', 1, '2022-12-21 16:05:14', '2023-02-20 05:20:55'),
(516, NULL, 16, 'Hi Every One', 'Welcome In App Pasti', 1, '2022-12-21 16:05:14', '2023-02-20 05:01:07'),
(517, 39, NULL, 'Modificare/Disdire', 'Ricordati che hai tempo fino alle ore 08:00 per modificare/disdire l’ordine del pranzo', 1, '2022-12-22 09:00:51', '2023-02-23 23:57:03'),
(518, 41, NULL, 'Modificare/Disdire', 'Ricordati che hai tempo fino alle ore 08:00 per modificare/disdire l’ordine del pranzo', 1, '2022-12-22 09:00:51', '2023-02-12 01:27:23'),
(519, 39, NULL, 'Notifica per ordinare pranzo', 'Ti ricordiamo di effettuare l’ordine del pranzo per domani entro le ore 10:00', 1, '2022-12-22 12:00:12', '2023-02-23 23:57:03'),
(520, 40, NULL, 'Notifica per ordinare pranzo', 'Ti ricordiamo di effettuare l’ordine del pranzo per domani entro le ore 10:00', 1, '2022-12-22 12:00:12', '2022-12-22 13:21:43'),
(521, 41, NULL, 'Notifica per ordinare pranzo', 'Ti ricordiamo di effettuare l’ordine del pranzo per domani entro le ore 10:00', 1, '2022-12-22 12:00:12', '2023-02-12 01:27:23'),
(522, 43, NULL, 'Notifica per ordinare pranzo', 'Ti ricordiamo di effettuare l’ordine del pranzo per domani entro le ore 10:00', 1, '2022-12-22 12:00:12', '2023-02-20 21:54:54'),
(524, 45, NULL, 'Notifica per ordinare pranzo', 'Ti ricordiamo di effettuare l’ordine del pranzo per domani entro le ore 10:00', 1, '2022-12-22 12:00:12', '2023-02-20 05:20:55'),
(525, 46, NULL, 'Notifica per ordinare pranzo', 'Ti ricordiamo di effettuare l’ordine del pranzo per domani entro le ore 10:00', 0, '2022-12-22 12:00:12', '2022-12-22 12:00:12'),
(526, 39, NULL, 'Notifica di avviso', 'Ti ricordiamo di ritirare il tuo pranzo', 1, '2022-12-22 14:50:49', '2023-02-23 23:57:03'),
(527, 41, NULL, 'Notifica di avviso', 'Ti ricordiamo di ritirare il tuo pranzo', 1, '2022-12-22 14:50:49', '2023-02-12 01:27:23'),
(528, 39, NULL, 'Modificare/Disdire', 'Ricordati che hai tempo fino alle ore 08:00 per modificare/disdire l’ordine del pranzo', 1, '2022-12-23 08:00:13', '2023-02-23 23:57:03'),
(529, 41, NULL, 'Modificare/Disdire', 'Ricordati che hai tempo fino alle ore 08:00 per modificare/disdire l’ordine del pranzo', 1, '2022-12-23 08:00:13', '2023-02-12 01:27:23'),
(530, 39, NULL, 'Notifica per ordinare pranzo', 'Ti ricordiamo di effettuare l’ordine del pranzo per domani entro le ore 10:00', 1, '2022-12-23 11:00:35', '2023-02-23 23:57:03'),
(531, 40, NULL, 'Notifica per ordinare pranzo', 'Ti ricordiamo di effettuare l’ordine del pranzo per domani entro le ore 10:00', 0, '2022-12-23 11:00:35', '2022-12-23 11:00:35'),
(532, 41, NULL, 'Notifica per ordinare pranzo', 'Ti ricordiamo di effettuare l’ordine del pranzo per domani entro le ore 10:00', 1, '2022-12-23 11:00:35', '2023-02-12 01:27:23'),
(533, 43, NULL, 'Notifica per ordinare pranzo', 'Ti ricordiamo di effettuare l’ordine del pranzo per domani entro le ore 10:00', 1, '2022-12-23 11:00:35', '2023-02-20 21:54:54'),
(535, 45, NULL, 'Notifica per ordinare pranzo', 'Ti ricordiamo di effettuare l’ordine del pranzo per domani entro le ore 10:00', 1, '2022-12-23 11:00:35', '2023-02-20 05:20:55'),
(536, 46, NULL, 'Notifica per ordinare pranzo', 'Ti ricordiamo di effettuare l’ordine del pranzo per domani entro le ore 10:00', 0, '2022-12-23 11:00:35', '2022-12-23 11:00:35'),
(537, 39, NULL, 'Notifica per l\'ordine', 'Non è più possibile modificare o annullare l\'ordine ora il tuo ordine in fase di preparazione.', 1, '2022-12-23 13:00:31', '2023-02-23 23:57:03'),
(538, 40, NULL, 'Notifica per l\'ordine', 'Non è più possibile modificare o annullare l\'ordine ora il tuo ordine in fase di preparazione.', 0, '2022-12-23 13:00:31', '2022-12-23 13:00:31'),
(539, 41, NULL, 'Notifica per l\'ordine', 'Non è più possibile modificare o annullare l\'ordine ora il tuo ordine in fase di preparazione.', 1, '2022-12-23 13:00:31', '2023-02-12 01:27:23'),
(540, 43, NULL, 'Notifica per l\'ordine', 'Non è più possibile modificare o annullare l\'ordine ora il tuo ordine in fase di preparazione.', 1, '2022-12-23 13:00:31', '2023-02-20 21:54:54'),
(542, 45, NULL, 'Notifica per l\'ordine', 'Non è più possibile modificare o annullare l\'ordine ora il tuo ordine in fase di preparazione.', 1, '2022-12-23 13:00:31', '2023-02-20 05:20:55'),
(543, 46, NULL, 'Notifica per l\'ordine', 'Non è più possibile modificare o annullare l\'ordine ora il tuo ordine in fase di preparazione.', 0, '2022-12-23 13:00:31', '2022-12-23 13:00:31'),
(544, 39, NULL, 'Notifica di avviso', 'Ti ricordiamo di ritirare il tuo pranzo', 1, '2022-12-23 14:50:42', '2023-02-23 23:57:03'),
(545, 41, NULL, 'Notifica di avviso', 'Ti ricordiamo di ritirare il tuo pranzo', 1, '2022-12-23 14:50:42', '2023-02-12 01:27:23'),
(546, 39, NULL, 'Notifica per ordinare pranzo', 'Ti ricordiamo di effettuare l’ordine del pranzo per domani entro le ore 10:00', 1, '2022-12-24 12:00:25', '2023-02-23 23:57:03'),
(547, 40, NULL, 'Notifica per ordinare pranzo', 'Ti ricordiamo di effettuare l’ordine del pranzo per domani entro le ore 10:00', 0, '2022-12-24 12:00:25', '2022-12-24 12:00:25'),
(548, 41, NULL, 'Notifica per ordinare pranzo', 'Ti ricordiamo di effettuare l’ordine del pranzo per domani entro le ore 10:00', 1, '2022-12-24 12:00:25', '2023-02-12 01:27:23'),
(549, 43, NULL, 'Notifica per ordinare pranzo', 'Ti ricordiamo di effettuare l’ordine del pranzo per domani entro le ore 10:00', 1, '2022-12-24 12:00:25', '2023-02-20 21:54:54'),
(551, 45, NULL, 'Notifica per ordinare pranzo', 'Ti ricordiamo di effettuare l’ordine del pranzo per domani entro le ore 10:00', 1, '2022-12-24 12:00:25', '2023-02-20 05:20:55'),
(552, 46, NULL, 'Notifica per ordinare pranzo', 'Ti ricordiamo di effettuare l’ordine del pranzo per domani entro le ore 10:00', 0, '2022-12-24 12:00:25', '2022-12-24 12:00:25'),
(553, 39, NULL, 'Notifica per l\'ordine', 'Non è più possibile modificare o annullare l\'ordine ora il tuo ordine in fase di preparazione.', 1, '2022-12-24 14:00:20', '2023-02-23 23:57:03'),
(554, 40, NULL, 'Notifica per l\'ordine', 'Non è più possibile modificare o annullare l\'ordine ora il tuo ordine in fase di preparazione.', 0, '2022-12-24 14:00:20', '2022-12-24 14:00:20'),
(555, 41, NULL, 'Notifica per l\'ordine', 'Non è più possibile modificare o annullare l\'ordine ora il tuo ordine in fase di preparazione.', 1, '2022-12-24 14:00:20', '2023-02-12 01:27:23'),
(556, 43, NULL, 'Notifica per l\'ordine', 'Non è più possibile modificare o annullare l\'ordine ora il tuo ordine in fase di preparazione.', 1, '2022-12-24 14:00:20', '2023-02-20 21:54:54'),
(558, 45, NULL, 'Notifica per l\'ordine', 'Non è più possibile modificare o annullare l\'ordine ora il tuo ordine in fase di preparazione.', 1, '2022-12-24 14:00:20', '2023-02-20 05:20:55'),
(559, 46, NULL, 'Notifica per l\'ordine', 'Non è più possibile modificare o annullare l\'ordine ora il tuo ordine in fase di preparazione.', 0, '2022-12-24 14:00:20', '2022-12-24 14:00:20'),
(560, 39, NULL, 'Notifica per ordinare pranzo', 'Ti ricordiamo di effettuare l’ordine del pranzo per domani entro le ore 10:00', 1, '2022-12-25 12:00:37', '2023-02-23 23:57:03'),
(561, 40, NULL, 'Notifica per ordinare pranzo', 'Ti ricordiamo di effettuare l’ordine del pranzo per domani entro le ore 10:00', 0, '2022-12-25 12:00:37', '2022-12-25 12:00:37'),
(562, 41, NULL, 'Notifica per ordinare pranzo', 'Ti ricordiamo di effettuare l’ordine del pranzo per domani entro le ore 10:00', 1, '2022-12-25 12:00:37', '2023-02-12 01:27:23'),
(563, 43, NULL, 'Notifica per ordinare pranzo', 'Ti ricordiamo di effettuare l’ordine del pranzo per domani entro le ore 10:00', 1, '2022-12-25 12:00:37', '2023-02-20 21:54:54'),
(565, 45, NULL, 'Notifica per ordinare pranzo', 'Ti ricordiamo di effettuare l’ordine del pranzo per domani entro le ore 10:00', 1, '2022-12-25 12:00:37', '2023-02-20 05:20:55'),
(566, 46, NULL, 'Notifica per ordinare pranzo', 'Ti ricordiamo di effettuare l’ordine del pranzo per domani entro le ore 10:00', 0, '2022-12-25 12:00:37', '2022-12-25 12:00:37'),
(567, 39, NULL, 'Notifica per l\'ordine', 'Non è più possibile modificare o annullare l\'ordine ora il tuo ordine in fase di preparazione.', 1, '2022-12-25 14:00:51', '2023-02-23 23:57:03'),
(568, 40, NULL, 'Notifica per l\'ordine', 'Non è più possibile modificare o annullare l\'ordine ora il tuo ordine in fase di preparazione.', 0, '2022-12-25 14:00:51', '2022-12-25 14:00:51'),
(569, 41, NULL, 'Notifica per l\'ordine', 'Non è più possibile modificare o annullare l\'ordine ora il tuo ordine in fase di preparazione.', 1, '2022-12-25 14:00:51', '2023-02-12 01:27:23'),
(570, 43, NULL, 'Notifica per l\'ordine', 'Non è più possibile modificare o annullare l\'ordine ora il tuo ordine in fase di preparazione.', 1, '2022-12-25 14:00:51', '2023-02-20 21:54:54'),
(572, 45, NULL, 'Notifica per l\'ordine', 'Non è più possibile modificare o annullare l\'ordine ora il tuo ordine in fase di preparazione.', 1, '2022-12-25 14:00:51', '2023-02-20 05:20:55'),
(573, 46, NULL, 'Notifica per l\'ordine', 'Non è più possibile modificare o annullare l\'ordine ora il tuo ordine in fase di preparazione.', 0, '2022-12-25 14:00:51', '2022-12-25 14:00:51'),
(574, 39, NULL, 'Modificare/Disdire', 'Ricordati che hai tempo fino alle ore 08:00 per modificare/disdire l’ordine del pranzo', 1, '2022-12-26 09:00:31', '2023-02-23 23:57:03'),
(575, 41, NULL, 'Modificare/Disdire', 'Ricordati che hai tempo fino alle ore 08:00 per modificare/disdire l’ordine del pranzo', 1, '2022-12-26 09:00:31', '2023-02-12 01:27:23'),
(576, 45, NULL, 'Modificare/Disdire', 'Ricordati che hai tempo fino alle ore 08:00 per modificare/disdire l’ordine del pranzo', 1, '2022-12-26 09:00:31', '2023-02-20 05:20:55'),
(577, 39, NULL, 'Notifica per ordinare pranzo', 'Ti ricordiamo di effettuare l’ordine del pranzo per domani entro le ore 10:00', 1, '2022-12-26 12:00:27', '2023-02-23 23:57:03'),
(578, 40, NULL, 'Notifica per ordinare pranzo', 'Ti ricordiamo di effettuare l’ordine del pranzo per domani entro le ore 10:00', 0, '2022-12-26 12:00:27', '2022-12-26 12:00:27'),
(579, 41, NULL, 'Notifica per ordinare pranzo', 'Ti ricordiamo di effettuare l’ordine del pranzo per domani entro le ore 10:00', 1, '2022-12-26 12:00:27', '2023-02-12 01:27:23'),
(580, 43, NULL, 'Notifica per ordinare pranzo', 'Ti ricordiamo di effettuare l’ordine del pranzo per domani entro le ore 10:00', 1, '2022-12-26 12:00:27', '2023-02-20 21:54:54'),
(582, 45, NULL, 'Notifica per ordinare pranzo', 'Ti ricordiamo di effettuare l’ordine del pranzo per domani entro le ore 10:00', 1, '2022-12-26 12:00:27', '2023-02-20 05:20:55'),
(583, 46, NULL, 'Notifica per ordinare pranzo', 'Ti ricordiamo di effettuare l’ordine del pranzo per domani entro le ore 10:00', 0, '2022-12-26 12:00:27', '2022-12-26 12:00:27'),
(584, 39, NULL, 'Notifica per l\'ordine', 'Non è più possibile modificare o annullare l\'ordine ora il tuo ordine in fase di preparazione.', 1, '2022-12-26 14:00:13', '2023-02-23 23:57:03'),
(585, 40, NULL, 'Notifica per l\'ordine', 'Non è più possibile modificare o annullare l\'ordine ora il tuo ordine in fase di preparazione.', 0, '2022-12-26 14:00:13', '2022-12-26 14:00:13'),
(586, 41, NULL, 'Notifica per l\'ordine', 'Non è più possibile modificare o annullare l\'ordine ora il tuo ordine in fase di preparazione.', 1, '2022-12-26 14:00:13', '2023-02-12 01:27:23'),
(587, 43, NULL, 'Notifica per l\'ordine', 'Non è più possibile modificare o annullare l\'ordine ora il tuo ordine in fase di preparazione.', 1, '2022-12-26 14:00:13', '2023-02-20 21:54:54'),
(589, 45, NULL, 'Notifica per l\'ordine', 'Non è più possibile modificare o annullare l\'ordine ora il tuo ordine in fase di preparazione.', 1, '2022-12-26 14:00:13', '2023-02-20 05:20:55'),
(590, 46, NULL, 'Notifica per l\'ordine', 'Non è più possibile modificare o annullare l\'ordine ora il tuo ordine in fase di preparazione.', 0, '2022-12-26 14:00:13', '2022-12-26 14:00:13'),
(591, 39, NULL, 'Notifica di avviso', 'Ti ricordiamo di ritirare il tuo pranzo', 1, '2022-12-26 15:50:36', '2023-02-23 23:57:03'),
(592, 41, NULL, 'Notifica di avviso', 'Ti ricordiamo di ritirare il tuo pranzo', 1, '2022-12-26 15:50:36', '2023-02-12 01:27:23'),
(593, 45, NULL, 'Notifica di avviso', 'Ti ricordiamo di ritirare il tuo pranzo', 1, '2022-12-26 15:50:36', '2023-02-20 05:20:55'),
(594, 39, NULL, 'Modificare/Disdire', 'Ricordati che hai tempo fino alle ore 08:00 per modificare/disdire l’ordine del pranzo', 1, '2022-12-27 09:00:32', '2023-02-23 23:57:03'),
(595, 41, NULL, 'Modificare/Disdire', 'Ricordati che hai tempo fino alle ore 08:00 per modificare/disdire l’ordine del pranzo', 1, '2022-12-27 09:00:32', '2023-02-12 01:27:23'),
(596, 45, NULL, 'Modificare/Disdire', 'Ricordati che hai tempo fino alle ore 08:00 per modificare/disdire l’ordine del pranzo', 1, '2022-12-27 09:00:32', '2023-02-20 05:20:55'),
(597, 39, NULL, 'Notifica per ordinare pranzo', 'Ti ricordiamo di effettuare l’ordine del pranzo per domani entro le ore 10:00', 1, '2022-12-27 12:00:05', '2023-02-23 23:57:03'),
(598, 40, NULL, 'Notifica per ordinare pranzo', 'Ti ricordiamo di effettuare l’ordine del pranzo per domani entro le ore 10:00', 0, '2022-12-27 12:00:05', '2022-12-27 12:00:05'),
(599, 41, NULL, 'Notifica per ordinare pranzo', 'Ti ricordiamo di effettuare l’ordine del pranzo per domani entro le ore 10:00', 1, '2022-12-27 12:00:05', '2023-02-12 01:27:23'),
(600, 43, NULL, 'Notifica per ordinare pranzo', 'Ti ricordiamo di effettuare l’ordine del pranzo per domani entro le ore 10:00', 1, '2022-12-27 12:00:05', '2023-02-20 21:54:54'),
(602, 45, NULL, 'Notifica per ordinare pranzo', 'Ti ricordiamo di effettuare l’ordine del pranzo per domani entro le ore 10:00', 1, '2022-12-27 12:00:05', '2023-02-20 05:20:55'),
(603, 46, NULL, 'Notifica per ordinare pranzo', 'Ti ricordiamo di effettuare l’ordine del pranzo per domani entro le ore 10:00', 0, '2022-12-27 12:00:05', '2022-12-27 12:00:05'),
(604, 39, NULL, 'Prova', 'Prova per le modifiche automatiche', 1, '2022-12-27 12:00:05', '2023-02-23 23:57:03'),
(605, 40, NULL, 'Prova', 'Prova per le modifiche automatiche', 0, '2022-12-27 12:00:05', '2022-12-27 12:00:05'),
(606, 41, NULL, 'Prova', 'Prova per le modifiche automatiche', 1, '2022-12-27 12:00:05', '2023-02-12 01:27:23'),
(607, 43, NULL, 'Prova', 'Prova per le modifiche automatiche', 1, '2022-12-27 12:00:05', '2023-02-20 21:54:54'),
(609, 45, NULL, 'Prova', 'Prova per le modifiche automatiche', 1, '2022-12-27 12:00:05', '2023-02-20 05:20:55'),
(610, 46, NULL, 'Prova', 'Prova per le modifiche automatiche', 0, '2022-12-27 12:00:05', '2022-12-27 12:00:05'),
(611, 39, NULL, 'Notifica per l\'ordine', 'Non è più possibile modificare o annullare l\'ordine ora il tuo ordine in fase di preparazione.', 1, '2022-12-27 14:00:20', '2023-02-23 23:57:03'),
(612, 40, NULL, 'Notifica per l\'ordine', 'Non è più possibile modificare o annullare l\'ordine ora il tuo ordine in fase di preparazione.', 0, '2022-12-27 14:00:20', '2022-12-27 14:00:20'),
(613, 41, NULL, 'Notifica per l\'ordine', 'Non è più possibile modificare o annullare l\'ordine ora il tuo ordine in fase di preparazione.', 1, '2022-12-27 14:00:20', '2023-02-12 01:27:23'),
(614, 43, NULL, 'Notifica per l\'ordine', 'Non è più possibile modificare o annullare l\'ordine ora il tuo ordine in fase di preparazione.', 1, '2022-12-27 14:00:20', '2023-02-20 21:54:54'),
(616, 45, NULL, 'Notifica per l\'ordine', 'Non è più possibile modificare o annullare l\'ordine ora il tuo ordine in fase di preparazione.', 1, '2022-12-27 14:00:20', '2023-02-20 05:20:55'),
(617, 46, NULL, 'Notifica per l\'ordine', 'Non è più possibile modificare o annullare l\'ordine ora il tuo ordine in fase di preparazione.', 0, '2022-12-27 14:00:20', '2022-12-27 14:00:20'),
(618, 39, NULL, 'Hi', 'Hi to Pasti app', 1, '2022-12-27 15:04:07', '2023-02-23 23:57:03'),
(619, 40, NULL, 'Hi', 'Hi to Pasti app', 0, '2022-12-27 15:04:07', '2022-12-27 15:04:07'),
(620, 41, NULL, 'Hi', 'Hi to Pasti app', 1, '2022-12-27 15:04:07', '2023-02-12 01:27:23'),
(621, 43, NULL, 'Hi', 'Hi to Pasti app', 1, '2022-12-27 15:04:07', '2023-02-20 21:54:54'),
(623, 45, NULL, 'Hi', 'Hi to Pasti app', 1, '2022-12-27 15:04:07', '2023-02-20 05:20:55'),
(624, 46, NULL, 'Hi', 'Hi to Pasti app', 0, '2022-12-27 15:04:07', '2022-12-27 15:04:07'),
(625, NULL, 16, 'Hi', 'Hi to Pasti app', 1, '2022-12-27 15:04:07', '2023-02-20 05:01:07'),
(626, 39, NULL, 'Hi', 'Hi to Pasti App', 1, '2022-12-27 15:04:35', '2023-02-23 23:57:03'),
(627, 40, NULL, 'Hi', 'Hi to Pasti App', 0, '2022-12-27 15:04:35', '2022-12-27 15:04:35'),
(628, 41, NULL, 'Hi', 'Hi to Pasti App', 1, '2022-12-27 15:04:35', '2023-02-12 01:27:23'),
(629, 43, NULL, 'Hi', 'Hi to Pasti App', 1, '2022-12-27 15:04:35', '2023-02-20 21:54:54'),
(631, 45, NULL, 'Hi', 'Hi to Pasti App', 1, '2022-12-27 15:04:35', '2023-02-20 05:20:55'),
(632, 46, NULL, 'Hi', 'Hi to Pasti App', 0, '2022-12-27 15:04:35', '2022-12-27 15:04:35'),
(633, NULL, 16, 'Hi', 'Hi to Pasti App', 1, '2022-12-27 15:04:36', '2023-02-20 05:01:07'),
(634, 39, NULL, 'Hi', 'Hi', 1, '2022-12-27 15:06:40', '2023-02-23 23:57:03'),
(635, 40, NULL, 'Hi', 'Hi', 0, '2022-12-27 15:06:40', '2022-12-27 15:06:40'),
(636, 41, NULL, 'Hi', 'Hi', 1, '2022-12-27 15:06:40', '2023-02-12 01:27:23'),
(637, 43, NULL, 'Hi', 'Hi', 1, '2022-12-27 15:06:40', '2023-02-20 21:54:54'),
(639, 45, NULL, 'Hi', 'Hi', 1, '2022-12-27 15:06:40', '2023-02-20 05:20:55'),
(640, 46, NULL, 'Hi', 'Hi', 0, '2022-12-27 15:06:40', '2022-12-27 15:06:40'),
(641, NULL, 16, 'Hi', 'Hi', 1, '2022-12-27 15:06:40', '2023-02-20 05:01:07'),
(642, 39, NULL, 'Hi', 'Hi', 1, '2022-12-27 15:09:13', '2023-02-23 23:57:03'),
(643, 40, NULL, 'Hi', 'Hi', 0, '2022-12-27 15:09:13', '2022-12-27 15:09:13'),
(644, 41, NULL, 'Hi', 'Hi', 1, '2022-12-27 15:09:13', '2023-02-12 01:27:23'),
(645, 43, NULL, 'Hi', 'Hi', 1, '2022-12-27 15:09:13', '2023-02-20 21:54:54'),
(647, 45, NULL, 'Hi', 'Hi', 1, '2022-12-27 15:09:13', '2023-02-20 05:20:55'),
(648, 46, NULL, 'Hi', 'Hi', 0, '2022-12-27 15:09:13', '2022-12-27 15:09:13'),
(649, NULL, 16, 'Hi', 'Hi', 1, '2022-12-27 15:09:13', '2023-02-20 05:01:07'),
(650, 39, NULL, 'Hi', 'Hi', 1, '2022-12-27 15:11:09', '2023-02-23 23:57:03'),
(651, 40, NULL, 'Hi', 'Hi', 0, '2022-12-27 15:11:09', '2022-12-27 15:11:09'),
(652, 41, NULL, 'Hi', 'Hi', 1, '2022-12-27 15:11:09', '2023-02-12 01:27:23'),
(653, 43, NULL, 'Hi', 'Hi', 1, '2022-12-27 15:11:09', '2023-02-20 21:54:54'),
(655, 45, NULL, 'Hi', 'Hi', 1, '2022-12-27 15:11:09', '2023-02-20 05:20:55'),
(656, 46, NULL, 'Hi', 'Hi', 0, '2022-12-27 15:11:09', '2022-12-27 15:11:09'),
(657, NULL, 16, 'Hi', 'Hi', 1, '2022-12-27 15:11:09', '2023-02-20 05:01:07'),
(658, 39, NULL, 'hi', 'hi', 1, '2022-12-27 15:22:04', '2023-02-23 23:57:03'),
(659, 40, NULL, 'hi', 'hi', 0, '2022-12-27 15:22:04', '2022-12-27 15:22:04'),
(660, 41, NULL, 'hi', 'hi', 1, '2022-12-27 15:22:04', '2023-02-12 01:27:23'),
(661, 43, NULL, 'hi', 'hi', 1, '2022-12-27 15:22:04', '2023-02-20 21:54:54'),
(663, 45, NULL, 'hi', 'hi', 1, '2022-12-27 15:22:04', '2023-02-20 05:20:55'),
(664, 46, NULL, 'hi', 'hi', 0, '2022-12-27 15:22:04', '2022-12-27 15:22:04'),
(665, NULL, 16, 'hi', 'hi', 1, '2022-12-27 15:22:04', '2023-02-20 05:01:07'),
(666, 39, NULL, 'hi', 'hi', 1, '2022-12-27 15:22:23', '2023-02-23 23:57:03'),
(667, 40, NULL, 'hi', 'hi', 0, '2022-12-27 15:22:23', '2022-12-27 15:22:23'),
(668, 41, NULL, 'hi', 'hi', 1, '2022-12-27 15:22:23', '2023-02-12 01:27:23'),
(669, 43, NULL, 'hi', 'hi', 1, '2022-12-27 15:22:23', '2023-02-20 21:54:54'),
(671, 45, NULL, 'hi', 'hi', 1, '2022-12-27 15:22:23', '2023-02-20 05:20:55'),
(672, 46, NULL, 'hi', 'hi', 0, '2022-12-27 15:22:23', '2022-12-27 15:22:23'),
(673, NULL, 16, 'hi', 'hi', 1, '2022-12-27 15:22:24', '2023-02-20 05:01:07'),
(674, 39, NULL, 'hi', 'hi', 1, '2022-12-27 15:22:44', '2023-02-23 23:57:03'),
(675, 40, NULL, 'hi', 'hi', 0, '2022-12-27 15:22:44', '2022-12-27 15:22:44'),
(676, 41, NULL, 'hi', 'hi', 1, '2022-12-27 15:22:44', '2023-02-12 01:27:23'),
(677, 43, NULL, 'hi', 'hi', 1, '2022-12-27 15:22:44', '2023-02-20 21:54:54'),
(679, 45, NULL, 'hi', 'hi', 1, '2022-12-27 15:22:44', '2023-02-20 05:20:55'),
(680, 46, NULL, 'hi', 'hi', 0, '2022-12-27 15:22:44', '2022-12-27 15:22:44'),
(681, NULL, 16, 'hi', 'hi', 1, '2022-12-27 15:22:44', '2023-02-20 05:01:07'),
(682, 39, NULL, 'hi', 'hi', 1, '2022-12-27 15:23:13', '2023-02-23 23:57:03'),
(683, 40, NULL, 'hi', 'hi', 0, '2022-12-27 15:23:13', '2022-12-27 15:23:13'),
(684, 41, NULL, 'hi', 'hi', 1, '2022-12-27 15:23:13', '2023-02-12 01:27:23'),
(685, 43, NULL, 'hi', 'hi', 1, '2022-12-27 15:23:13', '2023-02-20 21:54:54'),
(687, 45, NULL, 'hi', 'hi', 1, '2022-12-27 15:23:13', '2023-02-20 05:20:55'),
(688, 46, NULL, 'hi', 'hi', 0, '2022-12-27 15:23:13', '2022-12-27 15:23:13'),
(689, NULL, 16, 'hi', 'hi', 1, '2022-12-27 15:23:13', '2023-02-20 05:01:07'),
(690, 39, NULL, 'hi', 'hi', 1, '2022-12-27 15:23:49', '2023-02-23 23:57:03'),
(691, 40, NULL, 'hi', 'hi', 0, '2022-12-27 15:23:49', '2022-12-27 15:23:49'),
(692, 41, NULL, 'hi', 'hi', 1, '2022-12-27 15:23:49', '2023-02-12 01:27:23'),
(693, 43, NULL, 'hi', 'hi', 1, '2022-12-27 15:23:49', '2023-02-20 21:54:54'),
(695, 45, NULL, 'hi', 'hi', 1, '2022-12-27 15:23:49', '2023-02-20 05:20:55'),
(696, 46, NULL, 'hi', 'hi', 0, '2022-12-27 15:23:49', '2022-12-27 15:23:49'),
(697, NULL, 16, 'hi', 'hi', 1, '2022-12-27 15:23:49', '2023-02-20 05:01:07'),
(698, 39, NULL, 'hi', 'hi', 1, '2022-12-27 15:24:10', '2023-02-23 23:57:03'),
(699, 40, NULL, 'hi', 'hi', 0, '2022-12-27 15:24:10', '2022-12-27 15:24:10'),
(700, 41, NULL, 'hi', 'hi', 1, '2022-12-27 15:24:10', '2023-02-12 01:27:23'),
(701, 43, NULL, 'hi', 'hi', 1, '2022-12-27 15:24:10', '2023-02-20 21:54:54'),
(703, 45, NULL, 'hi', 'hi', 1, '2022-12-27 15:24:10', '2023-02-20 05:20:55'),
(704, 46, NULL, 'hi', 'hi', 0, '2022-12-27 15:24:10', '2022-12-27 15:24:10'),
(705, NULL, 16, 'hi', 'hi', 1, '2022-12-27 15:24:10', '2023-02-20 05:01:07'),
(706, 39, NULL, 'hi2', 'hi2', 1, '2022-12-27 15:24:27', '2023-02-23 23:57:03'),
(707, 40, NULL, 'hi2', 'hi2', 0, '2022-12-27 15:24:27', '2022-12-27 15:24:27'),
(708, 41, NULL, 'hi2', 'hi2', 1, '2022-12-27 15:24:27', '2023-02-12 01:27:23'),
(709, 43, NULL, 'hi2', 'hi2', 1, '2022-12-27 15:24:27', '2023-02-20 21:54:54'),
(711, 45, NULL, 'hi2', 'hi2', 1, '2022-12-27 15:24:27', '2023-02-20 05:20:55'),
(712, 46, NULL, 'hi2', 'hi2', 0, '2022-12-27 15:24:27', '2022-12-27 15:24:27'),
(713, NULL, 16, 'hi2', 'hi2', 1, '2022-12-27 15:24:28', '2023-02-20 05:01:07'),
(714, 39, NULL, 'Notifica di avviso', 'Ti ricordiamo di ritirare il tuo pranzo', 1, '2022-12-27 15:50:22', '2023-02-23 23:57:03'),
(715, 41, NULL, 'Notifica di avviso', 'Ti ricordiamo di ritirare il tuo pranzo', 1, '2022-12-27 15:50:22', '2023-02-12 01:27:23'),
(716, 45, NULL, 'Notifica di avviso', 'Ti ricordiamo di ritirare il tuo pranzo', 1, '2022-12-27 15:50:22', '2023-02-20 05:20:55'),
(717, 39, NULL, 'Prova', 'Prova per le modifiche automatiche', 1, '2022-12-27 19:20:17', '2023-02-23 23:57:03'),
(718, 40, NULL, 'Prova', 'Prova per le modifiche automatiche', 0, '2022-12-27 19:20:17', '2022-12-27 19:20:17'),
(719, 41, NULL, 'Prova', 'Prova per le modifiche automatiche', 1, '2022-12-27 19:20:17', '2023-02-12 01:27:23'),
(720, 43, NULL, 'Prova', 'Prova per le modifiche automatiche', 1, '2022-12-27 19:20:17', '2023-02-20 21:54:54'),
(722, 45, NULL, 'Prova', 'Prova per le modifiche automatiche', 1, '2022-12-27 19:20:17', '2023-02-20 05:20:55'),
(723, 46, NULL, 'Prova', 'Prova per le modifiche automatiche', 0, '2022-12-27 19:20:17', '2022-12-27 19:20:17'),
(724, 39, NULL, 'Nuovo Menù disponibile ', 'Nuovo Menù disponibile per il Lunedì  02-01-2023', 1, '2022-12-28 06:40:50', '2023-02-23 23:57:03'),
(725, 40, NULL, 'Nuovo Menù disponibile ', 'Nuovo Menù disponibile per il Lunedì  02-01-2023', 0, '2022-12-28 06:40:50', '2022-12-28 06:40:50'),
(726, 41, NULL, 'Nuovo Menù disponibile ', 'Nuovo Menù disponibile per il Lunedì  02-01-2023', 1, '2022-12-28 06:40:50', '2023-02-12 01:27:23'),
(727, 43, NULL, 'Nuovo Menù disponibile ', 'Nuovo Menù disponibile per il Lunedì  02-01-2023', 1, '2022-12-28 06:40:50', '2023-02-20 21:54:54'),
(729, 45, NULL, 'Nuovo Menù disponibile ', 'Nuovo Menù disponibile per il Lunedì  02-01-2023', 1, '2022-12-28 06:40:50', '2023-02-20 05:20:55'),
(730, 46, NULL, 'Nuovo Menù disponibile ', 'Nuovo Menù disponibile per il Lunedì  02-01-2023', 0, '2022-12-28 06:40:50', '2022-12-28 06:40:50'),
(731, 39, NULL, 'Nuovo Menù disponibile ', 'Nuovo Menù disponibile per il Lunedì  02-01-2023', 1, '2022-12-28 06:40:52', '2023-02-23 23:57:03'),
(732, 40, NULL, 'Nuovo Menù disponibile ', 'Nuovo Menù disponibile per il Lunedì  02-01-2023', 0, '2022-12-28 06:40:52', '2022-12-28 06:40:52'),
(733, 41, NULL, 'Nuovo Menù disponibile ', 'Nuovo Menù disponibile per il Lunedì  02-01-2023', 1, '2022-12-28 06:40:52', '2023-02-12 01:27:23'),
(734, 43, NULL, 'Nuovo Menù disponibile ', 'Nuovo Menù disponibile per il Lunedì  02-01-2023', 1, '2022-12-28 06:40:52', '2023-02-20 21:54:54'),
(736, 45, NULL, 'Nuovo Menù disponibile ', 'Nuovo Menù disponibile per il Lunedì  02-01-2023', 1, '2022-12-28 06:40:52', '2023-02-20 05:20:55'),
(737, 46, NULL, 'Nuovo Menù disponibile ', 'Nuovo Menù disponibile per il Lunedì  02-01-2023', 0, '2022-12-28 06:40:52', '2022-12-28 06:40:52'),
(738, 39, NULL, 'Nuovo Menù disponibile ', 'Nuovo Menù disponibile per il Lunedì  02-01-2023', 1, '2022-12-28 06:40:53', '2023-02-23 23:57:03'),
(739, 40, NULL, 'Nuovo Menù disponibile ', 'Nuovo Menù disponibile per il Lunedì  02-01-2023', 0, '2022-12-28 06:40:53', '2022-12-28 06:40:53'),
(740, 41, NULL, 'Nuovo Menù disponibile ', 'Nuovo Menù disponibile per il Lunedì  02-01-2023', 1, '2022-12-28 06:40:53', '2023-02-12 01:27:23'),
(741, 43, NULL, 'Nuovo Menù disponibile ', 'Nuovo Menù disponibile per il Lunedì  02-01-2023', 1, '2022-12-28 06:40:53', '2023-02-20 21:54:54'),
(743, 45, NULL, 'Nuovo Menù disponibile ', 'Nuovo Menù disponibile per il Lunedì  02-01-2023', 1, '2022-12-28 06:40:53', '2023-02-20 05:20:55'),
(744, 46, NULL, 'Nuovo Menù disponibile ', 'Nuovo Menù disponibile per il Lunedì  02-01-2023', 0, '2022-12-28 06:40:53', '2022-12-28 06:40:53'),
(745, 39, NULL, 'Nuovo Menù disponibile ', 'Nuovo Menù disponibile per il Martedì  03-01-2023', 1, '2022-12-28 06:40:55', '2023-02-23 23:57:03'),
(746, 40, NULL, 'Nuovo Menù disponibile ', 'Nuovo Menù disponibile per il Martedì  03-01-2023', 0, '2022-12-28 06:40:55', '2022-12-28 06:40:55'),
(747, 41, NULL, 'Nuovo Menù disponibile ', 'Nuovo Menù disponibile per il Martedì  03-01-2023', 1, '2022-12-28 06:40:55', '2023-02-12 01:27:23'),
(748, 43, NULL, 'Nuovo Menù disponibile ', 'Nuovo Menù disponibile per il Martedì  03-01-2023', 1, '2022-12-28 06:40:55', '2023-02-20 21:54:54'),
(750, 45, NULL, 'Nuovo Menù disponibile ', 'Nuovo Menù disponibile per il Martedì  03-01-2023', 1, '2022-12-28 06:40:55', '2023-02-20 05:20:55'),
(751, 46, NULL, 'Nuovo Menù disponibile ', 'Nuovo Menù disponibile per il Martedì  03-01-2023', 0, '2022-12-28 06:40:55', '2022-12-28 06:40:55'),
(752, 39, NULL, 'Nuovo Menù disponibile ', 'Nuovo Menù disponibile per il Martedì  03-01-2023', 1, '2022-12-28 06:40:57', '2023-02-23 23:57:03'),
(753, 40, NULL, 'Nuovo Menù disponibile ', 'Nuovo Menù disponibile per il Martedì  03-01-2023', 0, '2022-12-28 06:40:57', '2022-12-28 06:40:57'),
(754, 41, NULL, 'Nuovo Menù disponibile ', 'Nuovo Menù disponibile per il Martedì  03-01-2023', 1, '2022-12-28 06:40:57', '2023-02-12 01:27:23'),
(755, 43, NULL, 'Nuovo Menù disponibile ', 'Nuovo Menù disponibile per il Martedì  03-01-2023', 1, '2022-12-28 06:40:57', '2023-02-20 21:54:54'),
(757, 45, NULL, 'Nuovo Menù disponibile ', 'Nuovo Menù disponibile per il Martedì  03-01-2023', 1, '2022-12-28 06:40:57', '2023-02-20 05:20:55'),
(758, 46, NULL, 'Nuovo Menù disponibile ', 'Nuovo Menù disponibile per il Martedì  03-01-2023', 0, '2022-12-28 06:40:57', '2022-12-28 06:40:57'),
(759, 39, NULL, 'Nuovo Menù disponibile ', 'Nuovo Menù disponibile per il Martedì  03-01-2023', 1, '2022-12-28 06:40:58', '2023-02-23 23:57:03'),
(760, 40, NULL, 'Nuovo Menù disponibile ', 'Nuovo Menù disponibile per il Martedì  03-01-2023', 0, '2022-12-28 06:40:58', '2022-12-28 06:40:58'),
(761, 41, NULL, 'Nuovo Menù disponibile ', 'Nuovo Menù disponibile per il Martedì  03-01-2023', 1, '2022-12-28 06:40:58', '2023-02-12 01:27:23'),
(762, 43, NULL, 'Nuovo Menù disponibile ', 'Nuovo Menù disponibile per il Martedì  03-01-2023', 1, '2022-12-28 06:40:58', '2023-02-20 21:54:54'),
(764, 45, NULL, 'Nuovo Menù disponibile ', 'Nuovo Menù disponibile per il Martedì  03-01-2023', 1, '2022-12-28 06:40:58', '2023-02-20 05:20:55'),
(765, 46, NULL, 'Nuovo Menù disponibile ', 'Nuovo Menù disponibile per il Martedì  03-01-2023', 0, '2022-12-28 06:40:58', '2022-12-28 06:40:58'),
(766, 39, NULL, 'Nuovo Menù disponibile ', 'Nuovo Menù disponibile per il Mercoledì  04-01-2023', 1, '2022-12-28 06:40:59', '2023-02-23 23:57:03'),
(767, 40, NULL, 'Nuovo Menù disponibile ', 'Nuovo Menù disponibile per il Mercoledì  04-01-2023', 0, '2022-12-28 06:40:59', '2022-12-28 06:40:59'),
(768, 41, NULL, 'Nuovo Menù disponibile ', 'Nuovo Menù disponibile per il Mercoledì  04-01-2023', 1, '2022-12-28 06:40:59', '2023-02-12 01:27:23'),
(769, 43, NULL, 'Nuovo Menù disponibile ', 'Nuovo Menù disponibile per il Mercoledì  04-01-2023', 1, '2022-12-28 06:40:59', '2023-02-20 21:54:54'),
(771, 45, NULL, 'Nuovo Menù disponibile ', 'Nuovo Menù disponibile per il Mercoledì  04-01-2023', 1, '2022-12-28 06:40:59', '2023-02-20 05:20:55'),
(772, 46, NULL, 'Nuovo Menù disponibile ', 'Nuovo Menù disponibile per il Mercoledì  04-01-2023', 0, '2022-12-28 06:40:59', '2022-12-28 06:40:59'),
(773, 39, NULL, 'Nuovo Menù disponibile ', 'Nuovo Menù disponibile per il Mercoledì  04-01-2023', 1, '2022-12-28 06:41:01', '2023-02-23 23:57:03'),
(774, 40, NULL, 'Nuovo Menù disponibile ', 'Nuovo Menù disponibile per il Mercoledì  04-01-2023', 0, '2022-12-28 06:41:01', '2022-12-28 06:41:01'),
(775, 41, NULL, 'Nuovo Menù disponibile ', 'Nuovo Menù disponibile per il Mercoledì  04-01-2023', 1, '2022-12-28 06:41:01', '2023-02-12 01:27:23'),
(776, 43, NULL, 'Nuovo Menù disponibile ', 'Nuovo Menù disponibile per il Mercoledì  04-01-2023', 1, '2022-12-28 06:41:01', '2023-02-20 21:54:54'),
(778, 45, NULL, 'Nuovo Menù disponibile ', 'Nuovo Menù disponibile per il Mercoledì  04-01-2023', 1, '2022-12-28 06:41:01', '2023-02-20 05:20:55'),
(779, 46, NULL, 'Nuovo Menù disponibile ', 'Nuovo Menù disponibile per il Mercoledì  04-01-2023', 0, '2022-12-28 06:41:01', '2022-12-28 06:41:01'),
(780, 39, NULL, 'Nuovo Menù disponibile ', 'Nuovo Menù disponibile per il Mercoledì  04-01-2023', 1, '2022-12-28 06:41:02', '2023-02-23 23:57:03'),
(781, 40, NULL, 'Nuovo Menù disponibile ', 'Nuovo Menù disponibile per il Mercoledì  04-01-2023', 0, '2022-12-28 06:41:02', '2022-12-28 06:41:02'),
(782, 41, NULL, 'Nuovo Menù disponibile ', 'Nuovo Menù disponibile per il Mercoledì  04-01-2023', 1, '2022-12-28 06:41:02', '2023-02-12 01:27:23'),
(783, 43, NULL, 'Nuovo Menù disponibile ', 'Nuovo Menù disponibile per il Mercoledì  04-01-2023', 1, '2022-12-28 06:41:02', '2023-02-20 21:54:54'),
(785, 45, NULL, 'Nuovo Menù disponibile ', 'Nuovo Menù disponibile per il Mercoledì  04-01-2023', 1, '2022-12-28 06:41:02', '2023-02-20 05:20:55'),
(786, 46, NULL, 'Nuovo Menù disponibile ', 'Nuovo Menù disponibile per il Mercoledì  04-01-2023', 0, '2022-12-28 06:41:02', '2022-12-28 06:41:02'),
(787, 39, NULL, 'Nuovo Menù disponibile ', 'Nuovo Menù disponibile per il Giovedì  05-01-2023', 1, '2022-12-28 06:41:03', '2023-02-23 23:57:03'),
(788, 40, NULL, 'Nuovo Menù disponibile ', 'Nuovo Menù disponibile per il Giovedì  05-01-2023', 0, '2022-12-28 06:41:03', '2022-12-28 06:41:03'),
(789, 41, NULL, 'Nuovo Menù disponibile ', 'Nuovo Menù disponibile per il Giovedì  05-01-2023', 1, '2022-12-28 06:41:03', '2023-02-12 01:27:23'),
(790, 43, NULL, 'Nuovo Menù disponibile ', 'Nuovo Menù disponibile per il Giovedì  05-01-2023', 1, '2022-12-28 06:41:03', '2023-02-20 21:54:54'),
(792, 45, NULL, 'Nuovo Menù disponibile ', 'Nuovo Menù disponibile per il Giovedì  05-01-2023', 1, '2022-12-28 06:41:03', '2023-02-20 05:20:55'),
(793, 46, NULL, 'Nuovo Menù disponibile ', 'Nuovo Menù disponibile per il Giovedì  05-01-2023', 0, '2022-12-28 06:41:03', '2022-12-28 06:41:03'),
(794, 39, NULL, 'Nuovo Menù disponibile ', 'Nuovo Menù disponibile per il Giovedì  05-01-2023', 1, '2022-12-28 06:41:04', '2023-02-23 23:57:03'),
(795, 40, NULL, 'Nuovo Menù disponibile ', 'Nuovo Menù disponibile per il Giovedì  05-01-2023', 0, '2022-12-28 06:41:04', '2022-12-28 06:41:04'),
(796, 41, NULL, 'Nuovo Menù disponibile ', 'Nuovo Menù disponibile per il Giovedì  05-01-2023', 1, '2022-12-28 06:41:04', '2023-02-12 01:27:23'),
(797, 43, NULL, 'Nuovo Menù disponibile ', 'Nuovo Menù disponibile per il Giovedì  05-01-2023', 1, '2022-12-28 06:41:04', '2023-02-20 21:54:54'),
(799, 45, NULL, 'Nuovo Menù disponibile ', 'Nuovo Menù disponibile per il Giovedì  05-01-2023', 1, '2022-12-28 06:41:04', '2023-02-20 05:20:55'),
(800, 46, NULL, 'Nuovo Menù disponibile ', 'Nuovo Menù disponibile per il Giovedì  05-01-2023', 0, '2022-12-28 06:41:04', '2022-12-28 06:41:04'),
(801, 39, NULL, 'Nuovo Menù disponibile ', 'Nuovo Menù disponibile per il Giovedì  05-01-2023', 1, '2022-12-28 06:41:06', '2023-02-23 23:57:03'),
(802, 40, NULL, 'Nuovo Menù disponibile ', 'Nuovo Menù disponibile per il Giovedì  05-01-2023', 0, '2022-12-28 06:41:06', '2022-12-28 06:41:06'),
(803, 41, NULL, 'Nuovo Menù disponibile ', 'Nuovo Menù disponibile per il Giovedì  05-01-2023', 1, '2022-12-28 06:41:06', '2023-02-12 01:27:23'),
(804, 43, NULL, 'Nuovo Menù disponibile ', 'Nuovo Menù disponibile per il Giovedì  05-01-2023', 1, '2022-12-28 06:41:06', '2023-02-20 21:54:54'),
(806, 45, NULL, 'Nuovo Menù disponibile ', 'Nuovo Menù disponibile per il Giovedì  05-01-2023', 1, '2022-12-28 06:41:06', '2023-02-20 05:20:55'),
(807, 46, NULL, 'Nuovo Menù disponibile ', 'Nuovo Menù disponibile per il Giovedì  05-01-2023', 0, '2022-12-28 06:41:06', '2022-12-28 06:41:06'),
(808, 39, NULL, 'Nuovo Menù disponibile ', 'Nuovo Menù disponibile per il Venerdì  06-01-2023', 1, '2022-12-28 06:41:07', '2023-02-23 23:57:03'),
(809, 40, NULL, 'Nuovo Menù disponibile ', 'Nuovo Menù disponibile per il Venerdì  06-01-2023', 0, '2022-12-28 06:41:07', '2022-12-28 06:41:07'),
(810, 41, NULL, 'Nuovo Menù disponibile ', 'Nuovo Menù disponibile per il Venerdì  06-01-2023', 1, '2022-12-28 06:41:07', '2023-02-12 01:27:23'),
(811, 43, NULL, 'Nuovo Menù disponibile ', 'Nuovo Menù disponibile per il Venerdì  06-01-2023', 1, '2022-12-28 06:41:07', '2023-02-20 21:54:54'),
(813, 45, NULL, 'Nuovo Menù disponibile ', 'Nuovo Menù disponibile per il Venerdì  06-01-2023', 1, '2022-12-28 06:41:07', '2023-02-20 05:20:55'),
(814, 46, NULL, 'Nuovo Menù disponibile ', 'Nuovo Menù disponibile per il Venerdì  06-01-2023', 0, '2022-12-28 06:41:07', '2022-12-28 06:41:07'),
(815, 39, NULL, 'Nuovo Menù disponibile ', 'Nuovo Menù disponibile per il Venerdì  06-01-2023', 1, '2022-12-28 06:41:08', '2023-02-23 23:57:03'),
(816, 40, NULL, 'Nuovo Menù disponibile ', 'Nuovo Menù disponibile per il Venerdì  06-01-2023', 0, '2022-12-28 06:41:08', '2022-12-28 06:41:08'),
(817, 41, NULL, 'Nuovo Menù disponibile ', 'Nuovo Menù disponibile per il Venerdì  06-01-2023', 1, '2022-12-28 06:41:08', '2023-02-12 01:27:23'),
(818, 43, NULL, 'Nuovo Menù disponibile ', 'Nuovo Menù disponibile per il Venerdì  06-01-2023', 1, '2022-12-28 06:41:08', '2023-02-20 21:54:54'),
(820, 45, NULL, 'Nuovo Menù disponibile ', 'Nuovo Menù disponibile per il Venerdì  06-01-2023', 1, '2022-12-28 06:41:08', '2023-02-20 05:20:55'),
(821, 46, NULL, 'Nuovo Menù disponibile ', 'Nuovo Menù disponibile per il Venerdì  06-01-2023', 0, '2022-12-28 06:41:08', '2022-12-28 06:41:08'),
(822, 39, NULL, 'Nuovo Menù disponibile ', 'Nuovo Menù disponibile per il Venerdì  06-01-2023', 1, '2022-12-28 06:41:10', '2023-02-23 23:57:03'),
(823, 40, NULL, 'Nuovo Menù disponibile ', 'Nuovo Menù disponibile per il Venerdì  06-01-2023', 0, '2022-12-28 06:41:10', '2022-12-28 06:41:10'),
(824, 41, NULL, 'Nuovo Menù disponibile ', 'Nuovo Menù disponibile per il Venerdì  06-01-2023', 1, '2022-12-28 06:41:10', '2023-02-12 01:27:23'),
(825, 43, NULL, 'Nuovo Menù disponibile ', 'Nuovo Menù disponibile per il Venerdì  06-01-2023', 1, '2022-12-28 06:41:10', '2023-02-20 21:54:54'),
(827, 45, NULL, 'Nuovo Menù disponibile ', 'Nuovo Menù disponibile per il Venerdì  06-01-2023', 1, '2022-12-28 06:41:10', '2023-02-20 05:20:55'),
(828, 46, NULL, 'Nuovo Menù disponibile ', 'Nuovo Menù disponibile per il Venerdì  06-01-2023', 0, '2022-12-28 06:41:10', '2022-12-28 06:41:10'),
(829, 39, NULL, 'Nuovo Menù disponibile ', 'Nuovo Menù disponibile per il Lunedì  09-01-2023', 1, '2022-12-28 06:41:11', '2023-02-23 23:57:03'),
(830, 40, NULL, 'Nuovo Menù disponibile ', 'Nuovo Menù disponibile per il Lunedì  09-01-2023', 0, '2022-12-28 06:41:11', '2022-12-28 06:41:11'),
(831, 41, NULL, 'Nuovo Menù disponibile ', 'Nuovo Menù disponibile per il Lunedì  09-01-2023', 1, '2022-12-28 06:41:11', '2023-02-12 01:27:23'),
(832, 43, NULL, 'Nuovo Menù disponibile ', 'Nuovo Menù disponibile per il Lunedì  09-01-2023', 1, '2022-12-28 06:41:11', '2023-02-20 21:54:54'),
(834, 45, NULL, 'Nuovo Menù disponibile ', 'Nuovo Menù disponibile per il Lunedì  09-01-2023', 1, '2022-12-28 06:41:11', '2023-02-20 05:20:55'),
(835, 46, NULL, 'Nuovo Menù disponibile ', 'Nuovo Menù disponibile per il Lunedì  09-01-2023', 0, '2022-12-28 06:41:11', '2022-12-28 06:41:11'),
(836, 39, NULL, 'Nuovo Menù disponibile ', 'Nuovo Menù disponibile per il Lunedì  09-01-2023', 1, '2022-12-28 06:41:13', '2023-02-23 23:57:03'),
(837, 40, NULL, 'Nuovo Menù disponibile ', 'Nuovo Menù disponibile per il Lunedì  09-01-2023', 0, '2022-12-28 06:41:13', '2022-12-28 06:41:13'),
(838, 41, NULL, 'Nuovo Menù disponibile ', 'Nuovo Menù disponibile per il Lunedì  09-01-2023', 1, '2022-12-28 06:41:13', '2023-02-12 01:27:23'),
(839, 43, NULL, 'Nuovo Menù disponibile ', 'Nuovo Menù disponibile per il Lunedì  09-01-2023', 1, '2022-12-28 06:41:13', '2023-02-20 21:54:54'),
(841, 45, NULL, 'Nuovo Menù disponibile ', 'Nuovo Menù disponibile per il Lunedì  09-01-2023', 1, '2022-12-28 06:41:13', '2023-02-20 05:20:55'),
(842, 46, NULL, 'Nuovo Menù disponibile ', 'Nuovo Menù disponibile per il Lunedì  09-01-2023', 0, '2022-12-28 06:41:13', '2022-12-28 06:41:13'),
(843, 39, NULL, 'Nuovo Menù disponibile ', 'Nuovo Menù disponibile per il Lunedì  09-01-2023', 1, '2022-12-28 06:41:14', '2023-02-23 23:57:03'),
(844, 40, NULL, 'Nuovo Menù disponibile ', 'Nuovo Menù disponibile per il Lunedì  09-01-2023', 0, '2022-12-28 06:41:14', '2022-12-28 06:41:14'),
(845, 41, NULL, 'Nuovo Menù disponibile ', 'Nuovo Menù disponibile per il Lunedì  09-01-2023', 1, '2022-12-28 06:41:14', '2023-02-12 01:27:23'),
(846, 43, NULL, 'Nuovo Menù disponibile ', 'Nuovo Menù disponibile per il Lunedì  09-01-2023', 1, '2022-12-28 06:41:14', '2023-02-20 21:54:54'),
(848, 45, NULL, 'Nuovo Menù disponibile ', 'Nuovo Menù disponibile per il Lunedì  09-01-2023', 1, '2022-12-28 06:41:14', '2023-02-20 05:20:55');
INSERT INTO `notifications` (`id`, `user_id`, `school_id`, `title`, `message`, `is_read`, `created_at`, `updated_at`) VALUES
(849, 46, NULL, 'Nuovo Menù disponibile ', 'Nuovo Menù disponibile per il Lunedì  09-01-2023', 0, '2022-12-28 06:41:14', '2022-12-28 06:41:14'),
(850, 39, NULL, 'Nuovo Menù disponibile ', 'Nuovo Menù disponibile per il Martedì  10-01-2023', 1, '2022-12-28 06:41:15', '2023-02-23 23:57:03'),
(851, 40, NULL, 'Nuovo Menù disponibile ', 'Nuovo Menù disponibile per il Martedì  10-01-2023', 0, '2022-12-28 06:41:15', '2022-12-28 06:41:15'),
(852, 41, NULL, 'Nuovo Menù disponibile ', 'Nuovo Menù disponibile per il Martedì  10-01-2023', 1, '2022-12-28 06:41:15', '2023-02-12 01:27:23'),
(853, 43, NULL, 'Nuovo Menù disponibile ', 'Nuovo Menù disponibile per il Martedì  10-01-2023', 1, '2022-12-28 06:41:15', '2023-02-20 21:54:54'),
(855, 45, NULL, 'Nuovo Menù disponibile ', 'Nuovo Menù disponibile per il Martedì  10-01-2023', 1, '2022-12-28 06:41:15', '2023-02-20 05:20:55'),
(856, 46, NULL, 'Nuovo Menù disponibile ', 'Nuovo Menù disponibile per il Martedì  10-01-2023', 0, '2022-12-28 06:41:15', '2022-12-28 06:41:15'),
(857, 39, NULL, 'Nuovo Menù disponibile ', 'Nuovo Menù disponibile per il Martedì  10-01-2023', 1, '2022-12-28 06:41:17', '2023-02-23 23:57:03'),
(858, 40, NULL, 'Nuovo Menù disponibile ', 'Nuovo Menù disponibile per il Martedì  10-01-2023', 0, '2022-12-28 06:41:17', '2022-12-28 06:41:17'),
(859, 41, NULL, 'Nuovo Menù disponibile ', 'Nuovo Menù disponibile per il Martedì  10-01-2023', 1, '2022-12-28 06:41:17', '2023-02-12 01:27:23'),
(860, 43, NULL, 'Nuovo Menù disponibile ', 'Nuovo Menù disponibile per il Martedì  10-01-2023', 1, '2022-12-28 06:41:17', '2023-02-20 21:54:54'),
(862, 45, NULL, 'Nuovo Menù disponibile ', 'Nuovo Menù disponibile per il Martedì  10-01-2023', 1, '2022-12-28 06:41:17', '2023-02-20 05:20:55'),
(863, 46, NULL, 'Nuovo Menù disponibile ', 'Nuovo Menù disponibile per il Martedì  10-01-2023', 0, '2022-12-28 06:41:17', '2022-12-28 06:41:17'),
(864, 39, NULL, 'Nuovo Menù disponibile ', 'Nuovo Menù disponibile per il Martedì  10-01-2023', 1, '2022-12-28 06:41:19', '2023-02-23 23:57:03'),
(865, 40, NULL, 'Nuovo Menù disponibile ', 'Nuovo Menù disponibile per il Martedì  10-01-2023', 0, '2022-12-28 06:41:19', '2022-12-28 06:41:19'),
(866, 41, NULL, 'Nuovo Menù disponibile ', 'Nuovo Menù disponibile per il Martedì  10-01-2023', 1, '2022-12-28 06:41:19', '2023-02-12 01:27:23'),
(867, 43, NULL, 'Nuovo Menù disponibile ', 'Nuovo Menù disponibile per il Martedì  10-01-2023', 1, '2022-12-28 06:41:19', '2023-02-20 21:54:54'),
(869, 45, NULL, 'Nuovo Menù disponibile ', 'Nuovo Menù disponibile per il Martedì  10-01-2023', 1, '2022-12-28 06:41:19', '2023-02-20 05:20:55'),
(870, 46, NULL, 'Nuovo Menù disponibile ', 'Nuovo Menù disponibile per il Martedì  10-01-2023', 0, '2022-12-28 06:41:19', '2022-12-28 06:41:19'),
(871, 39, NULL, 'Modificare/Disdire', 'Ricordati che hai tempo fino alle ore 08:00 per modificare/disdire l’ordine del pranzo', 1, '2022-12-28 09:00:08', '2023-02-23 23:57:03'),
(872, 41, NULL, 'Modificare/Disdire', 'Ricordati che hai tempo fino alle ore 08:00 per modificare/disdire l’ordine del pranzo', 1, '2022-12-28 09:00:08', '2023-02-12 01:27:23'),
(873, 45, NULL, 'Modificare/Disdire', 'Ricordati che hai tempo fino alle ore 08:00 per modificare/disdire l’ordine del pranzo', 1, '2022-12-28 09:00:08', '2023-02-20 05:20:55'),
(874, 39, NULL, 'Notifica per ordinare pranzo', 'Ti ricordiamo di effettuare l’ordine del pranzo per domani entro le ore 10:00', 1, '2022-12-28 12:00:47', '2023-02-23 23:57:03'),
(875, 40, NULL, 'Notifica per ordinare pranzo', 'Ti ricordiamo di effettuare l’ordine del pranzo per domani entro le ore 10:00', 0, '2022-12-28 12:00:47', '2022-12-28 12:00:47'),
(876, 41, NULL, 'Notifica per ordinare pranzo', 'Ti ricordiamo di effettuare l’ordine del pranzo per domani entro le ore 10:00', 1, '2022-12-28 12:00:47', '2023-02-12 01:27:23'),
(877, 43, NULL, 'Notifica per ordinare pranzo', 'Ti ricordiamo di effettuare l’ordine del pranzo per domani entro le ore 10:00', 1, '2022-12-28 12:00:47', '2023-02-20 21:54:54'),
(879, 45, NULL, 'Notifica per ordinare pranzo', 'Ti ricordiamo di effettuare l’ordine del pranzo per domani entro le ore 10:00', 1, '2022-12-28 12:00:47', '2023-02-20 05:20:55'),
(880, 46, NULL, 'Notifica per ordinare pranzo', 'Ti ricordiamo di effettuare l’ordine del pranzo per domani entro le ore 10:00', 0, '2022-12-28 12:00:47', '2022-12-28 12:00:47'),
(881, 39, NULL, 'Prova', 'Prova per le modifiche automatiche', 1, '2022-12-28 12:00:48', '2023-02-23 23:57:03'),
(882, 40, NULL, 'Prova', 'Prova per le modifiche automatiche', 0, '2022-12-28 12:00:48', '2022-12-28 12:00:48'),
(883, 41, NULL, 'Prova', 'Prova per le modifiche automatiche', 1, '2022-12-28 12:00:48', '2023-02-12 01:27:23'),
(884, 43, NULL, 'Prova', 'Prova per le modifiche automatiche', 1, '2022-12-28 12:00:48', '2023-02-20 21:54:54'),
(886, 45, NULL, 'Prova', 'Prova per le modifiche automatiche', 1, '2022-12-28 12:00:48', '2023-02-20 05:20:55'),
(887, 46, NULL, 'Prova', 'Prova per le modifiche automatiche', 0, '2022-12-28 12:00:48', '2022-12-28 12:00:48'),
(888, 39, NULL, 'Notifica per l\'ordine', 'Non è più possibile modificare o annullare l\'ordine ora il tuo ordine in fase di preparazione.', 1, '2022-12-28 14:00:14', '2023-02-23 23:57:03'),
(889, 40, NULL, 'Notifica per l\'ordine', 'Non è più possibile modificare o annullare l\'ordine ora il tuo ordine in fase di preparazione.', 0, '2022-12-28 14:00:14', '2022-12-28 14:00:14'),
(890, 41, NULL, 'Notifica per l\'ordine', 'Non è più possibile modificare o annullare l\'ordine ora il tuo ordine in fase di preparazione.', 1, '2022-12-28 14:00:14', '2023-02-12 01:27:23'),
(891, 43, NULL, 'Notifica per l\'ordine', 'Non è più possibile modificare o annullare l\'ordine ora il tuo ordine in fase di preparazione.', 1, '2022-12-28 14:00:14', '2023-02-20 21:54:54'),
(893, 45, NULL, 'Notifica per l\'ordine', 'Non è più possibile modificare o annullare l\'ordine ora il tuo ordine in fase di preparazione.', 1, '2022-12-28 14:00:14', '2023-02-20 05:20:55'),
(894, 46, NULL, 'Notifica per l\'ordine', 'Non è più possibile modificare o annullare l\'ordine ora il tuo ordine in fase di preparazione.', 0, '2022-12-28 14:00:14', '2022-12-28 14:00:14'),
(895, 39, NULL, 'hi', 'hi', 1, '2022-12-28 14:59:35', '2023-02-23 23:57:03'),
(896, 40, NULL, 'hi', 'hi', 0, '2022-12-28 14:59:35', '2022-12-28 14:59:35'),
(897, 41, NULL, 'hi', 'hi', 1, '2022-12-28 14:59:35', '2023-02-12 01:27:23'),
(898, 43, NULL, 'hi', 'hi', 1, '2022-12-28 14:59:35', '2023-02-20 21:54:54'),
(900, 45, NULL, 'hi', 'hi', 1, '2022-12-28 14:59:35', '2023-02-20 05:20:55'),
(901, 46, NULL, 'hi', 'hi', 0, '2022-12-28 14:59:35', '2022-12-28 14:59:35'),
(902, NULL, 16, 'hi', 'hi', 1, '2022-12-28 14:59:36', '2023-02-20 05:01:07'),
(903, 39, NULL, 'hi', 'hi', 1, '2022-12-28 14:59:49', '2023-02-23 23:57:03'),
(904, 40, NULL, 'hi', 'hi', 0, '2022-12-28 14:59:49', '2022-12-28 14:59:49'),
(905, 41, NULL, 'hi', 'hi', 1, '2022-12-28 14:59:49', '2023-02-12 01:27:23'),
(906, 43, NULL, 'hi', 'hi', 1, '2022-12-28 14:59:49', '2023-02-20 21:54:54'),
(908, 45, NULL, 'hi', 'hi', 1, '2022-12-28 14:59:49', '2023-02-20 05:20:55'),
(909, 46, NULL, 'hi', 'hi', 0, '2022-12-28 14:59:49', '2022-12-28 14:59:49'),
(910, NULL, 16, 'hi', 'hi', 1, '2022-12-28 14:59:49', '2023-02-20 05:01:07'),
(911, 39, NULL, 'hi', 'hi', 1, '2022-12-28 15:00:25', '2023-02-23 23:57:03'),
(912, 40, NULL, 'hi', 'hi', 0, '2022-12-28 15:00:25', '2022-12-28 15:00:25'),
(913, 41, NULL, 'hi', 'hi', 1, '2022-12-28 15:00:25', '2023-02-12 01:27:23'),
(914, 43, NULL, 'hi', 'hi', 1, '2022-12-28 15:00:25', '2023-02-20 21:54:54'),
(916, 45, NULL, 'hi', 'hi', 1, '2022-12-28 15:00:25', '2023-02-20 05:20:55'),
(917, 46, NULL, 'hi', 'hi', 0, '2022-12-28 15:00:25', '2022-12-28 15:00:25'),
(918, NULL, 16, 'hi', 'hi', 1, '2022-12-28 15:00:25', '2023-02-20 05:01:07'),
(919, 39, NULL, 'hi', 'hi', 1, '2022-12-28 15:00:57', '2023-02-23 23:57:03'),
(920, 40, NULL, 'hi', 'hi', 0, '2022-12-28 15:00:57', '2022-12-28 15:00:57'),
(921, 41, NULL, 'hi', 'hi', 1, '2022-12-28 15:00:57', '2023-02-12 01:27:23'),
(922, 43, NULL, 'hi', 'hi', 1, '2022-12-28 15:00:57', '2023-02-20 21:54:54'),
(924, 45, NULL, 'hi', 'hi', 1, '2022-12-28 15:00:57', '2023-02-20 05:20:55'),
(925, 46, NULL, 'hi', 'hi', 0, '2022-12-28 15:00:57', '2022-12-28 15:00:57'),
(926, NULL, 16, 'hi', 'hi', 1, '2022-12-28 15:00:57', '2023-02-20 05:01:07'),
(927, 39, NULL, 'Notifica di avviso', 'Ti ricordiamo di ritirare il tuo pranzo', 1, '2022-12-28 15:50:13', '2023-02-23 23:57:03'),
(928, 41, NULL, 'Notifica di avviso', 'Ti ricordiamo di ritirare il tuo pranzo', 1, '2022-12-28 15:50:13', '2023-02-12 01:27:23'),
(929, 45, NULL, 'Notifica di avviso', 'Ti ricordiamo di ritirare il tuo pranzo', 1, '2022-12-28 15:50:13', '2023-02-20 05:20:55'),
(930, 39, NULL, 'Notifica per ordinare pranzo', 'Ti ricordiamo di effettuare l’ordine del pranzo per domani entro le ore 10:00', 1, '2022-12-29 12:00:02', '2023-02-23 23:57:03'),
(931, 40, NULL, 'Notifica per ordinare pranzo', 'Ti ricordiamo di effettuare l’ordine del pranzo per domani entro le ore 10:00', 0, '2022-12-29 12:00:02', '2022-12-29 12:00:02'),
(932, 41, NULL, 'Notifica per ordinare pranzo', 'Ti ricordiamo di effettuare l’ordine del pranzo per domani entro le ore 10:00', 1, '2022-12-29 12:00:02', '2023-02-12 01:27:23'),
(933, 43, NULL, 'Notifica per ordinare pranzo', 'Ti ricordiamo di effettuare l’ordine del pranzo per domani entro le ore 10:00', 1, '2022-12-29 12:00:02', '2023-02-20 21:54:54'),
(935, 45, NULL, 'Notifica per ordinare pranzo', 'Ti ricordiamo di effettuare l’ordine del pranzo per domani entro le ore 10:00', 1, '2022-12-29 12:00:02', '2023-02-20 05:20:55'),
(936, 46, NULL, 'Notifica per ordinare pranzo', 'Ti ricordiamo di effettuare l’ordine del pranzo per domani entro le ore 10:00', 0, '2022-12-29 12:00:02', '2022-12-29 12:00:02'),
(937, 39, NULL, 'Prova', 'Prova per le modifiche automatiche', 1, '2022-12-29 12:00:02', '2023-02-23 23:57:03'),
(938, 40, NULL, 'Prova', 'Prova per le modifiche automatiche', 0, '2022-12-29 12:00:02', '2022-12-29 12:00:02'),
(939, 41, NULL, 'Prova', 'Prova per le modifiche automatiche', 1, '2022-12-29 12:00:02', '2023-02-12 01:27:23'),
(940, 43, NULL, 'Prova', 'Prova per le modifiche automatiche', 1, '2022-12-29 12:00:02', '2023-02-20 21:54:54'),
(942, 45, NULL, 'Prova', 'Prova per le modifiche automatiche', 1, '2022-12-29 12:00:02', '2023-02-20 05:20:55'),
(943, 46, NULL, 'Prova', 'Prova per le modifiche automatiche', 0, '2022-12-29 12:00:02', '2022-12-29 12:00:02'),
(944, 39, NULL, 'Notifica per l\'ordine', 'Non è più possibile modificare o annullare l\'ordine ora il tuo ordine in fase di preparazione.', 1, '2022-12-29 14:00:45', '2023-02-23 23:57:03'),
(945, 40, NULL, 'Notifica per l\'ordine', 'Non è più possibile modificare o annullare l\'ordine ora il tuo ordine in fase di preparazione.', 0, '2022-12-29 14:00:45', '2022-12-29 14:00:45'),
(946, 41, NULL, 'Notifica per l\'ordine', 'Non è più possibile modificare o annullare l\'ordine ora il tuo ordine in fase di preparazione.', 1, '2022-12-29 14:00:45', '2023-02-12 01:27:23'),
(947, 43, NULL, 'Notifica per l\'ordine', 'Non è più possibile modificare o annullare l\'ordine ora il tuo ordine in fase di preparazione.', 1, '2022-12-29 14:00:45', '2023-02-20 21:54:54'),
(949, 45, NULL, 'Notifica per l\'ordine', 'Non è più possibile modificare o annullare l\'ordine ora il tuo ordine in fase di preparazione.', 1, '2022-12-29 14:00:45', '2023-02-20 05:20:55'),
(950, 46, NULL, 'Notifica per l\'ordine', 'Non è più possibile modificare o annullare l\'ordine ora il tuo ordine in fase di preparazione.', 0, '2022-12-29 14:00:45', '2022-12-29 14:00:45'),
(951, 39, NULL, 'Notifica per ordinare pranzo', 'Ti ricordiamo di effettuare l’ordine del pranzo per domani entro le ore 10:00', 1, '2022-12-30 12:00:05', '2023-02-23 23:57:03'),
(952, 40, NULL, 'Notifica per ordinare pranzo', 'Ti ricordiamo di effettuare l’ordine del pranzo per domani entro le ore 10:00', 0, '2022-12-30 12:00:05', '2022-12-30 12:00:05'),
(953, 41, NULL, 'Notifica per ordinare pranzo', 'Ti ricordiamo di effettuare l’ordine del pranzo per domani entro le ore 10:00', 1, '2022-12-30 12:00:05', '2023-02-12 01:27:23'),
(954, 43, NULL, 'Notifica per ordinare pranzo', 'Ti ricordiamo di effettuare l’ordine del pranzo per domani entro le ore 10:00', 1, '2022-12-30 12:00:05', '2023-02-20 21:54:54'),
(956, 45, NULL, 'Notifica per ordinare pranzo', 'Ti ricordiamo di effettuare l’ordine del pranzo per domani entro le ore 10:00', 1, '2022-12-30 12:00:05', '2023-02-20 05:20:55'),
(957, 46, NULL, 'Notifica per ordinare pranzo', 'Ti ricordiamo di effettuare l’ordine del pranzo per domani entro le ore 10:00', 0, '2022-12-30 12:00:05', '2022-12-30 12:00:05'),
(958, 39, NULL, 'Prova', 'Prova per le modifiche automatiche', 1, '2022-12-30 12:00:05', '2023-02-23 23:57:03'),
(959, 40, NULL, 'Prova', 'Prova per le modifiche automatiche', 0, '2022-12-30 12:00:05', '2022-12-30 12:00:05'),
(960, 41, NULL, 'Prova', 'Prova per le modifiche automatiche', 1, '2022-12-30 12:00:05', '2023-02-12 01:27:23'),
(961, 43, NULL, 'Prova', 'Prova per le modifiche automatiche', 1, '2022-12-30 12:00:05', '2023-02-20 21:54:54'),
(963, 45, NULL, 'Prova', 'Prova per le modifiche automatiche', 1, '2022-12-30 12:00:05', '2023-02-20 05:20:55'),
(964, 46, NULL, 'Prova', 'Prova per le modifiche automatiche', 0, '2022-12-30 12:00:05', '2022-12-30 12:00:05'),
(965, 39, NULL, 'Notifica per l\'ordine', 'Non è più possibile modificare o annullare l\'ordine ora il tuo ordine in fase di preparazione.', 1, '2022-12-30 14:00:40', '2023-02-23 23:57:03'),
(966, 40, NULL, 'Notifica per l\'ordine', 'Non è più possibile modificare o annullare l\'ordine ora il tuo ordine in fase di preparazione.', 0, '2022-12-30 14:00:40', '2022-12-30 14:00:40'),
(967, 41, NULL, 'Notifica per l\'ordine', 'Non è più possibile modificare o annullare l\'ordine ora il tuo ordine in fase di preparazione.', 1, '2022-12-30 14:00:40', '2023-02-12 01:27:23'),
(968, 43, NULL, 'Notifica per l\'ordine', 'Non è più possibile modificare o annullare l\'ordine ora il tuo ordine in fase di preparazione.', 1, '2022-12-30 14:00:40', '2023-02-20 21:54:54'),
(970, 45, NULL, 'Notifica per l\'ordine', 'Non è più possibile modificare o annullare l\'ordine ora il tuo ordine in fase di preparazione.', 1, '2022-12-30 14:00:40', '2023-02-20 05:20:55'),
(971, 46, NULL, 'Notifica per l\'ordine', 'Non è più possibile modificare o annullare l\'ordine ora il tuo ordine in fase di preparazione.', 0, '2022-12-30 14:00:40', '2022-12-30 14:00:40'),
(972, 39, NULL, 'Notifica per ordinare pranzo', 'Ti ricordiamo di effettuare l’ordine del pranzo per domani entro le ore 10:00', 1, '2022-12-31 12:00:50', '2023-02-23 23:57:03'),
(973, 40, NULL, 'Notifica per ordinare pranzo', 'Ti ricordiamo di effettuare l’ordine del pranzo per domani entro le ore 10:00', 0, '2022-12-31 12:00:50', '2022-12-31 12:00:50'),
(974, 41, NULL, 'Notifica per ordinare pranzo', 'Ti ricordiamo di effettuare l’ordine del pranzo per domani entro le ore 10:00', 1, '2022-12-31 12:00:50', '2023-02-12 01:27:23'),
(975, 43, NULL, 'Notifica per ordinare pranzo', 'Ti ricordiamo di effettuare l’ordine del pranzo per domani entro le ore 10:00', 1, '2022-12-31 12:00:50', '2023-02-20 21:54:54'),
(977, 45, NULL, 'Notifica per ordinare pranzo', 'Ti ricordiamo di effettuare l’ordine del pranzo per domani entro le ore 10:00', 1, '2022-12-31 12:00:50', '2023-02-20 05:20:55'),
(978, 46, NULL, 'Notifica per ordinare pranzo', 'Ti ricordiamo di effettuare l’ordine del pranzo per domani entro le ore 10:00', 0, '2022-12-31 12:00:50', '2022-12-31 12:00:50'),
(979, 39, NULL, 'Prova', 'Prova per le modifiche automatiche', 1, '2022-12-31 12:00:50', '2023-02-23 23:57:03'),
(980, 40, NULL, 'Prova', 'Prova per le modifiche automatiche', 0, '2022-12-31 12:00:50', '2022-12-31 12:00:50'),
(981, 41, NULL, 'Prova', 'Prova per le modifiche automatiche', 1, '2022-12-31 12:00:50', '2023-02-12 01:27:23'),
(982, 43, NULL, 'Prova', 'Prova per le modifiche automatiche', 1, '2022-12-31 12:00:50', '2023-02-20 21:54:54'),
(984, 45, NULL, 'Prova', 'Prova per le modifiche automatiche', 1, '2022-12-31 12:00:50', '2023-02-20 05:20:55'),
(985, 46, NULL, 'Prova', 'Prova per le modifiche automatiche', 0, '2022-12-31 12:00:50', '2022-12-31 12:00:50'),
(986, 39, NULL, 'Notifica per l\'ordine', 'Non è più possibile modificare o annullare l\'ordine ora il tuo ordine in fase di preparazione.', 1, '2022-12-31 14:00:20', '2023-02-23 23:57:03'),
(987, 40, NULL, 'Notifica per l\'ordine', 'Non è più possibile modificare o annullare l\'ordine ora il tuo ordine in fase di preparazione.', 0, '2022-12-31 14:00:20', '2022-12-31 14:00:20'),
(988, 41, NULL, 'Notifica per l\'ordine', 'Non è più possibile modificare o annullare l\'ordine ora il tuo ordine in fase di preparazione.', 1, '2022-12-31 14:00:20', '2023-02-12 01:27:23'),
(989, 43, NULL, 'Notifica per l\'ordine', 'Non è più possibile modificare o annullare l\'ordine ora il tuo ordine in fase di preparazione.', 1, '2022-12-31 14:00:20', '2023-02-20 21:54:54'),
(991, 45, NULL, 'Notifica per l\'ordine', 'Non è più possibile modificare o annullare l\'ordine ora il tuo ordine in fase di preparazione.', 1, '2022-12-31 14:00:20', '2023-02-20 05:20:55'),
(992, 46, NULL, 'Notifica per l\'ordine', 'Non è più possibile modificare o annullare l\'ordine ora il tuo ordine in fase di preparazione.', 0, '2022-12-31 14:00:20', '2022-12-31 14:00:20'),
(993, 39, NULL, 'Notifica per ordinare pranzo', 'Ti ricordiamo di effettuare l’ordine del pranzo per domani entro le ore 10:00', 1, '2023-01-01 12:00:21', '2023-02-23 23:57:03'),
(994, 40, NULL, 'Notifica per ordinare pranzo', 'Ti ricordiamo di effettuare l’ordine del pranzo per domani entro le ore 10:00', 0, '2023-01-01 12:00:21', '2023-01-01 12:00:21'),
(995, 41, NULL, 'Notifica per ordinare pranzo', 'Ti ricordiamo di effettuare l’ordine del pranzo per domani entro le ore 10:00', 1, '2023-01-01 12:00:21', '2023-02-12 01:27:23'),
(996, 43, NULL, 'Notifica per ordinare pranzo', 'Ti ricordiamo di effettuare l’ordine del pranzo per domani entro le ore 10:00', 1, '2023-01-01 12:00:21', '2023-02-20 21:54:54'),
(998, 45, NULL, 'Notifica per ordinare pranzo', 'Ti ricordiamo di effettuare l’ordine del pranzo per domani entro le ore 10:00', 1, '2023-01-01 12:00:21', '2023-02-20 05:20:55'),
(999, 46, NULL, 'Notifica per ordinare pranzo', 'Ti ricordiamo di effettuare l’ordine del pranzo per domani entro le ore 10:00', 0, '2023-01-01 12:00:21', '2023-01-01 12:00:21'),
(1000, 39, NULL, 'Prova', 'Prova per le modifiche automatiche', 1, '2023-01-01 12:00:21', '2023-02-23 23:57:03'),
(1001, 40, NULL, 'Prova', 'Prova per le modifiche automatiche', 0, '2023-01-01 12:00:21', '2023-01-01 12:00:21'),
(1002, 41, NULL, 'Prova', 'Prova per le modifiche automatiche', 1, '2023-01-01 12:00:21', '2023-02-12 01:27:23'),
(1003, 43, NULL, 'Prova', 'Prova per le modifiche automatiche', 1, '2023-01-01 12:00:21', '2023-02-20 21:54:54'),
(1005, 45, NULL, 'Prova', 'Prova per le modifiche automatiche', 1, '2023-01-01 12:00:21', '2023-02-20 05:20:55'),
(1006, 46, NULL, 'Prova', 'Prova per le modifiche automatiche', 0, '2023-01-01 12:00:21', '2023-01-01 12:00:21'),
(1007, 39, NULL, 'Notifica per l\'ordine', 'Non è più possibile modificare o annullare l\'ordine ora il tuo ordine in fase di preparazione.', 1, '2023-01-01 14:00:05', '2023-02-23 23:57:03'),
(1008, 40, NULL, 'Notifica per l\'ordine', 'Non è più possibile modificare o annullare l\'ordine ora il tuo ordine in fase di preparazione.', 0, '2023-01-01 14:00:05', '2023-01-01 14:00:05'),
(1009, 41, NULL, 'Notifica per l\'ordine', 'Non è più possibile modificare o annullare l\'ordine ora il tuo ordine in fase di preparazione.', 1, '2023-01-01 14:00:05', '2023-02-12 01:27:23'),
(1010, 43, NULL, 'Notifica per l\'ordine', 'Non è più possibile modificare o annullare l\'ordine ora il tuo ordine in fase di preparazione.', 1, '2023-01-01 14:00:05', '2023-02-20 21:54:54'),
(1012, 45, NULL, 'Notifica per l\'ordine', 'Non è più possibile modificare o annullare l\'ordine ora il tuo ordine in fase di preparazione.', 1, '2023-01-01 14:00:05', '2023-02-20 05:20:55'),
(1013, 46, NULL, 'Notifica per l\'ordine', 'Non è più possibile modificare o annullare l\'ordine ora il tuo ordine in fase di preparazione.', 0, '2023-01-01 14:00:05', '2023-01-01 14:00:05'),
(1014, 39, NULL, 'Notifica per ordinare pranzo', 'Ti ricordiamo di effettuare l’ordine del pranzo per domani entro le ore 10:00', 1, '2023-01-02 12:00:50', '2023-02-23 23:57:03'),
(1015, 40, NULL, 'Notifica per ordinare pranzo', 'Ti ricordiamo di effettuare l’ordine del pranzo per domani entro le ore 10:00', 0, '2023-01-02 12:00:50', '2023-01-02 12:00:50'),
(1016, 41, NULL, 'Notifica per ordinare pranzo', 'Ti ricordiamo di effettuare l’ordine del pranzo per domani entro le ore 10:00', 1, '2023-01-02 12:00:50', '2023-02-12 01:27:23'),
(1017, 43, NULL, 'Notifica per ordinare pranzo', 'Ti ricordiamo di effettuare l’ordine del pranzo per domani entro le ore 10:00', 1, '2023-01-02 12:00:50', '2023-02-20 21:54:54'),
(1019, 45, NULL, 'Notifica per ordinare pranzo', 'Ti ricordiamo di effettuare l’ordine del pranzo per domani entro le ore 10:00', 1, '2023-01-02 12:00:50', '2023-02-20 05:20:55'),
(1020, 46, NULL, 'Notifica per ordinare pranzo', 'Ti ricordiamo di effettuare l’ordine del pranzo per domani entro le ore 10:00', 0, '2023-01-02 12:00:50', '2023-01-02 12:00:50'),
(1021, 39, NULL, 'Prova', 'Prova per le modifiche automatiche', 1, '2023-01-02 12:00:50', '2023-02-23 23:57:03'),
(1022, 40, NULL, 'Prova', 'Prova per le modifiche automatiche', 0, '2023-01-02 12:00:50', '2023-01-02 12:00:50'),
(1023, 41, NULL, 'Prova', 'Prova per le modifiche automatiche', 1, '2023-01-02 12:00:50', '2023-02-12 01:27:23'),
(1024, 43, NULL, 'Prova', 'Prova per le modifiche automatiche', 1, '2023-01-02 12:00:50', '2023-02-20 21:54:54'),
(1026, 45, NULL, 'Prova', 'Prova per le modifiche automatiche', 1, '2023-01-02 12:00:50', '2023-02-20 05:20:55'),
(1027, 46, NULL, 'Prova', 'Prova per le modifiche automatiche', 0, '2023-01-02 12:00:50', '2023-01-02 12:00:50'),
(1028, 39, NULL, 'Lo stato del tuo ordine è cambiato', 'La tua richiesta è stata completata', 1, '2023-01-02 12:50:52', '2023-02-23 23:57:03'),
(1029, 41, NULL, 'Lo stato del tuo ordine è cambiato', 'La tua richiesta è stata completata', 1, '2023-01-02 12:50:55', '2023-02-12 01:27:23'),
(1030, 39, NULL, 'Lo stato del tuo ordine è cambiato', 'La tua richiesta è stata completata', 1, '2023-01-02 12:50:58', '2023-02-23 23:57:03'),
(1031, 41, NULL, 'Lo stato del tuo ordine è cambiato', 'La tua richiesta è stata completata', 1, '2023-01-02 12:51:01', '2023-02-12 01:27:23'),
(1032, 41, NULL, 'Lo stato del tuo ordine è cambiato', 'La tua richiesta è stata completata', 1, '2023-01-02 12:51:04', '2023-02-12 01:27:23'),
(1033, 41, NULL, 'Lo stato del tuo ordine è cambiato', 'La tua richiesta è stata completata', 1, '2023-01-02 12:51:13', '2023-02-12 01:27:23'),
(1034, 39, NULL, 'Notifica per l\'ordine', 'Non è più possibile modificare o annullare l\'ordine ora il tuo ordine in fase di preparazione.', 1, '2023-01-02 14:00:39', '2023-02-23 23:57:03'),
(1035, 40, NULL, 'Notifica per l\'ordine', 'Non è più possibile modificare o annullare l\'ordine ora il tuo ordine in fase di preparazione.', 0, '2023-01-02 14:00:39', '2023-01-02 14:00:39'),
(1036, 41, NULL, 'Notifica per l\'ordine', 'Non è più possibile modificare o annullare l\'ordine ora il tuo ordine in fase di preparazione.', 1, '2023-01-02 14:00:39', '2023-02-12 01:27:23'),
(1037, 43, NULL, 'Notifica per l\'ordine', 'Non è più possibile modificare o annullare l\'ordine ora il tuo ordine in fase di preparazione.', 1, '2023-01-02 14:00:39', '2023-02-20 21:54:54'),
(1039, 45, NULL, 'Notifica per l\'ordine', 'Non è più possibile modificare o annullare l\'ordine ora il tuo ordine in fase di preparazione.', 1, '2023-01-02 14:00:39', '2023-02-20 05:20:55'),
(1040, 46, NULL, 'Notifica per l\'ordine', 'Non è più possibile modificare o annullare l\'ordine ora il tuo ordine in fase di preparazione.', 0, '2023-01-02 14:00:39', '2023-01-02 14:00:39'),
(1041, 39, NULL, 'Notifica per ordinare pranzo', 'Ti ricordiamo di effettuare l’ordine del pranzo per domani entro le ore 10:00', 1, '2023-01-03 12:00:23', '2023-02-23 23:57:03'),
(1042, 40, NULL, 'Notifica per ordinare pranzo', 'Ti ricordiamo di effettuare l’ordine del pranzo per domani entro le ore 10:00', 0, '2023-01-03 12:00:23', '2023-01-03 12:00:23'),
(1043, 41, NULL, 'Notifica per ordinare pranzo', 'Ti ricordiamo di effettuare l’ordine del pranzo per domani entro le ore 10:00', 1, '2023-01-03 12:00:23', '2023-02-12 01:27:23'),
(1044, 43, NULL, 'Notifica per ordinare pranzo', 'Ti ricordiamo di effettuare l’ordine del pranzo per domani entro le ore 10:00', 1, '2023-01-03 12:00:23', '2023-02-20 21:54:54'),
(1046, 45, NULL, 'Notifica per ordinare pranzo', 'Ti ricordiamo di effettuare l’ordine del pranzo per domani entro le ore 10:00', 1, '2023-01-03 12:00:23', '2023-02-20 05:20:55'),
(1047, 46, NULL, 'Notifica per ordinare pranzo', 'Ti ricordiamo di effettuare l’ordine del pranzo per domani entro le ore 10:00', 0, '2023-01-03 12:00:23', '2023-01-03 12:00:23'),
(1048, 39, NULL, 'Notifica per l\'ordine', 'Non è più possibile modificare o annullare l\'ordine ora il tuo ordine in fase di preparazione.', 1, '2023-01-03 14:00:31', '2023-02-23 23:57:03'),
(1049, 40, NULL, 'Notifica per l\'ordine', 'Non è più possibile modificare o annullare l\'ordine ora il tuo ordine in fase di preparazione.', 0, '2023-01-03 14:00:32', '2023-01-03 14:00:32'),
(1050, 41, NULL, 'Notifica per l\'ordine', 'Non è più possibile modificare o annullare l\'ordine ora il tuo ordine in fase di preparazione.', 1, '2023-01-03 14:00:32', '2023-02-12 01:27:23'),
(1051, 43, NULL, 'Notifica per l\'ordine', 'Non è più possibile modificare o annullare l\'ordine ora il tuo ordine in fase di preparazione.', 1, '2023-01-03 14:00:32', '2023-02-20 21:54:54'),
(1053, 45, NULL, 'Notifica per l\'ordine', 'Non è più possibile modificare o annullare l\'ordine ora il tuo ordine in fase di preparazione.', 1, '2023-01-03 14:00:32', '2023-02-20 05:20:55'),
(1054, 46, NULL, 'Notifica per l\'ordine', 'Non è più possibile modificare o annullare l\'ordine ora il tuo ordine in fase di preparazione.', 0, '2023-01-03 14:00:32', '2023-01-03 14:00:32'),
(1055, 39, NULL, 'Notifica per ordinare pranzo', 'Ti ricordiamo di effettuare l’ordine del pranzo per domani entro le ore 10:00', 1, '2023-01-04 12:00:51', '2023-02-23 23:57:03'),
(1056, 40, NULL, 'Notifica per ordinare pranzo', 'Ti ricordiamo di effettuare l’ordine del pranzo per domani entro le ore 10:00', 0, '2023-01-04 12:00:51', '2023-01-04 12:00:51'),
(1057, 41, NULL, 'Notifica per ordinare pranzo', 'Ti ricordiamo di effettuare l’ordine del pranzo per domani entro le ore 10:00', 1, '2023-01-04 12:00:51', '2023-02-12 01:27:23'),
(1058, 43, NULL, 'Notifica per ordinare pranzo', 'Ti ricordiamo di effettuare l’ordine del pranzo per domani entro le ore 10:00', 1, '2023-01-04 12:00:51', '2023-02-20 21:54:54'),
(1060, 45, NULL, 'Notifica per ordinare pranzo', 'Ti ricordiamo di effettuare l’ordine del pranzo per domani entro le ore 10:00', 1, '2023-01-04 12:00:51', '2023-02-20 05:20:55'),
(1061, 46, NULL, 'Notifica per ordinare pranzo', 'Ti ricordiamo di effettuare l’ordine del pranzo per domani entro le ore 10:00', 0, '2023-01-04 12:00:51', '2023-01-04 12:00:51'),
(1062, 39, NULL, 'Notifica per l\'ordine', 'Non è più possibile modificare o annullare l\'ordine ora il tuo ordine in fase di preparazione.', 1, '2023-01-04 14:00:13', '2023-02-23 23:57:03'),
(1063, 40, NULL, 'Notifica per l\'ordine', 'Non è più possibile modificare o annullare l\'ordine ora il tuo ordine in fase di preparazione.', 0, '2023-01-04 14:00:13', '2023-01-04 14:00:13'),
(1064, 41, NULL, 'Notifica per l\'ordine', 'Non è più possibile modificare o annullare l\'ordine ora il tuo ordine in fase di preparazione.', 1, '2023-01-04 14:00:13', '2023-02-12 01:27:23'),
(1065, 43, NULL, 'Notifica per l\'ordine', 'Non è più possibile modificare o annullare l\'ordine ora il tuo ordine in fase di preparazione.', 1, '2023-01-04 14:00:13', '2023-02-20 21:54:54'),
(1067, 45, NULL, 'Notifica per l\'ordine', 'Non è più possibile modificare o annullare l\'ordine ora il tuo ordine in fase di preparazione.', 1, '2023-01-04 14:00:13', '2023-02-20 05:20:55'),
(1068, 46, NULL, 'Notifica per l\'ordine', 'Non è più possibile modificare o annullare l\'ordine ora il tuo ordine in fase di preparazione.', 0, '2023-01-04 14:00:13', '2023-01-04 14:00:13'),
(1069, 39, NULL, 'Modificare/Disdire', 'Ricordati che hai tempo fino alle ore 08:00 per modificare/disdire l’ordine del pranzo', 1, '2023-01-05 09:00:49', '2023-02-23 23:57:03'),
(1070, 41, NULL, 'Modificare/Disdire', 'Ricordati che hai tempo fino alle ore 08:00 per modificare/disdire l’ordine del pranzo', 1, '2023-01-05 09:00:49', '2023-02-12 01:27:23'),
(1071, 39, NULL, 'Notifica per ordinare pranzo', 'Ti ricordiamo di effettuare l’ordine del pranzo per domani entro le ore 10:00', 1, '2023-01-05 12:00:32', '2023-02-23 23:57:03'),
(1072, 40, NULL, 'Notifica per ordinare pranzo', 'Ti ricordiamo di effettuare l’ordine del pranzo per domani entro le ore 10:00', 0, '2023-01-05 12:00:32', '2023-01-05 12:00:32'),
(1073, 41, NULL, 'Notifica per ordinare pranzo', 'Ti ricordiamo di effettuare l’ordine del pranzo per domani entro le ore 10:00', 1, '2023-01-05 12:00:32', '2023-02-12 01:27:23'),
(1074, 43, NULL, 'Notifica per ordinare pranzo', 'Ti ricordiamo di effettuare l’ordine del pranzo per domani entro le ore 10:00', 1, '2023-01-05 12:00:32', '2023-02-20 21:54:54'),
(1076, 45, NULL, 'Notifica per ordinare pranzo', 'Ti ricordiamo di effettuare l’ordine del pranzo per domani entro le ore 10:00', 1, '2023-01-05 12:00:32', '2023-02-20 05:20:55'),
